"X","hand.label","expert.ind","max.class","verified","username","description","hand.label_simplified"
834,"media","no","media",TRUE,"LisaGreenbergTV","Morning Anchor @Fox4Now, SWFL • Emmy-nominated, hometown journalist • @UF grad • sushi lover • I sing 24/7 • tip? wanna be pals? -- lisa.greenberg@fox4now.com","media"
835,"media","yes","media",TRUE,"TheDailyFray","Land, water, air, space. Motion. Editor for https://t.co/IAja233rh5; multimedia editor for Sarasota @heraldtribune. Member of the Society of Environmental Journalists.","media"
836,"media","no","media",TRUE,"rchristiepbp","Executive Editor of The Palm Beach Post; Deputy Regional Editor for USAT Network-Florida. I LOVE news! ... Tweet @ me! BTW, retweets are NOT an endorsement.","media"
837,"media","no","media",TRUE,"jaxdotcom","Sharing the latest news and information from The Florida Times-Union and https://t.co/KGFlby7PeC. Follow @LOCALiQJax for media and marketing solutions.","media"
838,"media","yes","media",TRUE,"PaulRogersSJMN","Journalist covering environmental and science news for the San Jose Mercury News.","media"
839,"media","no","media",TRUE,"HT_GunWriter","Chief editor of @2AFDN Investigative Journalism Project, former newspaperman, tactical shooter, Army vet, ex-LEO, 1*, Rum snob.    
https://t.co/N0qCqGxIns","media"
840,"media","no","media",TRUE,"emily_lecoz","Investigations @USATODAY. Past Deputy I-Team Editor @HeraldTribune. Wisconsin. France. Mississippi. Florida.","media"
841,"media","no","media",TRUE,"vboey","Reporter for FOX Orlando, Wife, President of AAJA FL, Journalism Mentor, Orange Cty Asian Committee member. Opinions are my own. Retweets are not endorsements.","media"
842,"media","no","media",TRUE,"garywhite13","Reporter at The Ledger. Fla. native. Newsroom leader for @newsguild. Retweets don't imply agreement. News tips: gary.white@theledger.com or 863-802-7518.","media"
843,"media","no","media",TRUE,"NewsbySmiley","Washington editor for @MiamiHerald and @McClatchy. There's always a Florida connection. Tips at dsmiley@miamiherald.com 305-376-2284","media"
845,"media","no","media",TRUE,"hannahwinston","journalist testing the west coast waters | she/her | previously: @pbpost, @UF, and many more | Floridian in the PNW | say hi: hannahwinston (at) gmail :waving hand:","media"
846,"media","no","media",TRUE,"AMontgomery_998","VP of Audio @Slate. Ex @NPR. Journalist, writer, citizen, mom of a beautiful autistic kid. She/her. All opinions mine. All facts matter.","media"
847,"media","no","media",TRUE,"ThuyLanNews","She/her. Wisconsinite. Two parts, one name.
Assistant news director @wbir. 
Previous stops in Tampa, Buffalo, Bakersfield. @cronkite_asu alum.","media"
848,"media","no","media",TRUE,"DaniCHurtado_","@ABC13houston journalist.:movie camera: @UFJSchool Grad. :crocodile: Former: @mysuncoast @KFYRTV @WUFTNews Have a tip? Daniela.C.Hurtado@abc.com :red heart:: :flag: Venezuela::flag: United States:","media"
849,"media","no","media",TRUE,"hakaimagazine","An award-winning online magazine connecting you with stories about science and societies from coasts around the world. :water wave: (“HACK-eye"""")","media"
850,"media","no","media",TRUE,"therealjsolo","Capitol bureau reporter for the @timesunion","media"
851,"media","no","media",TRUE,"MadisonAlworth","Correspondent @FoxBusiness. Previously @10TampaBay, @cheddar, @TODAYshow. Yale Class of 2015, Co-founder and former editor of YTV","media"
852,"media","no","media",TRUE,"RBrown_HTOpin","Opinion Editor for the Sarasota Herald-Tribune. A Cleveland, OH native who loves the Jacksonville Jaguars and Man United. roger.brown@heraldtribune.com","media"
853,"media","yes","media",TRUE,"SteveBenderWx","Girl dad • FOX Weather Meteorologist/Correspondent • Outdoor Junkie • Nature and Wildlife Nerd | Story ideas: steve.bender@fox.com","media"
854,"media","no","media",TRUE,"WFLAWalt","Investigative reporter for WFLA in Tampa. Searching for the ghost of Tom Joad. Send tips to wbuteau@wfla.com","media"
855,"media","no","media",TRUE,"hannah_dineen","@10TampaBay Nightside reporter • Previously @NEWSCENTERMaine • EMMY nominated storyteller • Colby College alumn • Washed-up ice hockey player","media"
856,"media","no","media",TRUE,"SamDiazReporter","Reporter for @telemundo49. Covering #Manatee & #Sarasota. Storyteller. Tealover. RTs ≠ endorsements. | Periodista. Hija de la Blanqui y LeLoLai born & raised.","media"
857,"media","yes","media",TRUE,"AShipleyWX","@fox4now Meteorologist|Retired Student-Athlete|@FloridaTech Alumni|FMR @cbs4rgv, @KEZI9, & @NewsCenter1|Jesus+Nothing=Everything","media"
858,"media","yes","media",TRUE,"TrentAricTV","Morning Meteorologist at @Fox4Now in Southwest Florida. Outdoor Enthusiast and Nature Lover. Father to a 5 year old ball of energy.","media"
859,"media","yes","media",TRUE,"JacquiJerasTV","On-Camera Meteorologist: The Weather Channel. 
Love weather, space, and chocolate. Runner, Mom, Midwest roots. 
 CBM & NWA seals.","media"
860,"media","no","media",TRUE,"wsls","Thank you for stopping by @WSLS -- the place to go for local stories, the latest breaking news, weather updates, sports and more. 
Email: news@wsls.com","media"
861,"media","no","media",TRUE,"steflugli","journalist @theklc journal & @planetavenuson :newspaper::woman detective: medium-light skin tone: kenji’s mom :paw prints: :flag: Venezuela: she/hers","media"
862,"media","yes","media",TRUE,"KatieWallsTV","Two-time Emmy winner | AMS Certified Meteorologist | Meteorology Degrees from FSU & Penn State | Mom & Wife | 0 Tolerance for Trolling/Insults/Cursing","media"
863,"media","no","media",TRUE,"chrisearlSWFL","6/10/11 pm Anchor, @Fox4Now in SWFL after 25 years in IA-WI-MN-KS stations.  Wisconsin ‘97.  3x novelist. Ian survivor, decent chef, meh tennis player.","media"
864,"media","yes","media",TRUE,"NatalieWTSP",":television: Meteorologist on @10TampaBay | 6 & 11pm on #Nightside","media"
865,"media","no","media",TRUE,"Omar_fromPR","breaking news reporter via @miamiherald (Sun-Thu, p.m.) - orodriguezortiz@miamiherald.com | text: (305) 376-2218 @oneheraldguild :flag: Puerto Rico:","media"
866,"media","no","media",TRUE,"billritter7","Anchor at Eyewitness News on Channel 7 WABC-TV in New York City. Re-Tweets are not endorsements #RealNews","media"
867,"media","yes","media",TRUE,"breakingweather","Breaking weather alerts and timely weather news updates from @AccuWeather forecasters. Email support@accuweather.com for support.","media"
868,"media","no","media",TRUE,"knoxnews","News from the Knoxville News Sentinel (https://t.co/xSv9rgPVYl), a part of the USA TODAY Network.","media"
869,"media","no","media",TRUE,"ABC","The only official ABC News Twitter account. Download our new mobile app: https://t.co/6WupJH6wUx","media"
870,"media","no","media",TRUE,"kslnewsradio","Utah's #1 radio station. Stream live at https://t.co/QIu8QvnnAN. Send story ideas to digitalcontentradio@bonneville.com. Text NEWS to 57500 for breaking news updates","media"
871,"media-acad","no","media",TRUE,"KwallevandWDAY","WDAY TV News Reporter since 1983. Journalism Adjunct at MSUM. Proud Otter Tail Co. native. National Edward R. Murrow Awards and Emmys for doc/special projects.","media"
872,"media","no","media",TRUE,"6abc","Philadelphia area news, traffic, weather, politics and sports from WPVI, including breaking news & AccuWeather forecast.","media"
873,"media","no","media",TRUE,"GrayHall6abc","Emmy Award winning Anchor/Reporter","media"
874,"media","yes","media",TRUE,"JMichaelsNews","National Correspondent @weatherchannel • Whisk(e)y Enthusiast • Sailor • ‘JMichaelsNews’ On All Social Media • Connect: Justin.Michaels@weathergroup.com","media"
875,"media","yes","media",TRUE,"JerryWVTM13","Chief Meteorologist at @WVTM13. Arrived here back in July of 1987, Still loving Birmingham and Alabama! Links and RTs aren't endorsements. Opinions are my own.","media"
876,"media","no","media",TRUE,"WVTM13","#WVTM13, your home for central Alabama breaking news, sports and weather.","media"
877,"media","yes","media",TRUE,"johnupton","@ClimateCentral editor — collaborating with scientists and with local newsrooms, coproducing print, digital, radio and TV features informed by new climate data.","media"
878,"media","no","media",TRUE,"WFLAKeith","WFLA TV News Anchor/Reporter","media"
879,"media","no","media",TRUE,"ChloeNordquist","@ScrippsNews National Journalist, based in CO | @Cronkite_ASU Grad | Adventurer | Often found w/ camera, caffeine & skis | chloe.nordquist@scripps.com","media"
880,"media","no","media",TRUE,"ryanegorman","Morning show host on @WFLANews. Host of iHeartRadio Communities and national news events for @iHeartRadio. :studio microphone: :flag: United States:","media"
881,"media","no","media",TRUE,"BrionaArradondo","Weekend PM Anchor & PM Reporter for @Fox13news | Emmy-winning journalist | Atlanta native | @berrycollege @AmericanU alum | Consumer of many pop culture fandoms","media"
882,"media","no","media",TRUE,"RobbinSimmons7","Mother| Anchor/Reporter| :flag: United States:/:flag: Italy:| Emmy winner| @WSVN @uiowa/@MedillSchool| IG:@RobbinSimmons7:two hearts::green heart:","media"
883,"media","no","media",TRUE,"mySA","San Antonio’s source for breaking news, culture y más :rolled-up newspaper: • Mastodon: https://t.co/r3J2c9j97r","media"
884,"acad-media","no","media",TRUE,"alisonannyoung","Curtis B. Hurley Chair in Public Affairs Reporting, Missouri School of Journalism DC Program + investigative reporter alisonyoungreports@gmail.com DM for Signal","acad"
885,"media","no","media",TRUE,"billscher","Politics Editor for the Washington @Monthly. Also, contributor @politico @realclearnews, @DMZShow, When America Worked podcast. (Avi by @Jess_Sassenach.)","media"
886,"media","no","media",TRUE,"TomoNewsUS","Your best source for animated news.","media"
887,"media","no","media",TRUE,"nbcsandiego","Breaking news, exclusive stories, weather and investigations in San Diego.","media"
888,"media","no","media",TRUE,"MBakerTBTimes","College football reporter for the Tampa Bay Times. Indiana native. Northwestern grad. AP Top 25 & Heisman voter. mbaker@tampabay.com","media"
889,"media","no","media",TRUE,"KatieLSanders","@politifact managing editor, based at @poynter","media"
890,"media","no","media",TRUE,"Desi_Stennett","Senior Reporter @orlandosentinel writing about race, identity and inequality. Reach me: dstennett@orlandosentinel.com FAMU grad. She/Her.","media"
891,"media","no","media",TRUE,"orlandosentinel","Central Florida's most comprehensive news source. Subscriber concerns: 407-420-5353. News tips: https://t.co/KqyuPd6tZd.","media"
892,"media","no","media",TRUE,"EdwardGLuce","Associate Editor, Financial Times, US-based writer/columnist. Author The Retreat of Western Liberalism, In Spite of the Gods, Time to Start Thinking. My views.","media"
893,"media","no","media",TRUE,"PNS_FL","We're an independent news service. Our stories examine the effects of policy on areas that often receive too little coverage. https://t.co/Q3hBzCVNbj","media"
894,"media","no","media",TRUE,"PNS_News","Public News Service, a Certified B Corporation, lifts voices often unheard in mainstream media to 50 million+ news lovers per week. #NewsThatMatters","media"
895,"media","no","media",TRUE,"microsoftnews","Trusted news from the world's best journalists.","media"
896,"media","no","media",TRUE,"gelles","Executive Producer @MeetThePress","media"
897,"media","no","media",TRUE,"CNN","It’s our job to #GoThere & tell the most difficult stories. For breaking news, follow @CNNBRK and download our app https://t.co/ceNBoNiGnE","media"
898,"media","yes","media",TRUE,"Jackson_Dill","Meteorologist at @WSVN 7 News || Former: @CNN || University of Miami Alumnus :raising hands: || New Englander turned Floridian","media"
899,"media","no","media",TRUE,"TimesDan","Courts and criminal justice reporter for the @TB_Times. Storyteller. Trial watcher. Submitter of public records requests. Man about town. I hate Twitter.","media"
900,"media","yes","media",TRUE,"HMNorthey","Reporter @POLITICO's E&E News covering 'critical' mining, EVs, water. Michigander. Fmly @LSJNews, @MichiganRadio, @ICFJ, @KnightCenter. hnorthey@eenews.net","media"
901,"media","no","media",TRUE,"ijournal","We've got property/casualty insurance news covered. We are the highest P/C news site in the world.","media"
902,"media","yes","media",TRUE,"Whitleyweather","Chief Meteorologist @wmbbtv, Follower of Christ. Opinions are my own.","media"
903,"media","no","media",TRUE,"meghabuda",":woman technologist: Senior Engagement Editor, @TB_Times. :sandwich: Formerly: Food and Drink Editor, @cl_tampabay. Views are mine.","media"
904,"media","no","media",TRUE,"DaylinaMiller","Journalist @NPR @WUSF | nonbinary | queer | member of @TransJa | ADHD | #KidneyDonor :green heart: | tabletop gamer | horror enthusiast | atheist witch","media"
905,"media","no","media",TRUE,"producedbylex","journalist | @FAMU_1887 alumna | previously @greenvillenews @tennessean |","media"
906,"media","no","media",TRUE,"VancouverSun","Western Canada's largest news team.  Send tips to VanTips@postmedia.com. Follow us at https://t.co/wfK8J4aDF3 and https://t.co/4UZZKFxQPO.","media"
907,"media","no","media",TRUE,"TheTorontoSun","Toronto's best local news, sports, entertainment, comment, pictures and video.","media"
908,"media","no","media",TRUE,"ottawasuncom","News, Sports, Entertainment, Comment from Canada's Capital. Words, photos, video, blogs, chats, forums & more","media"
909,"media","no","media",TRUE,"RobAbramowitz","Broadcaster: @NYCFC & @NYJets radio, @NFLonCBS, @EspecialistasDD HBO +. Ex-ESPN Dep/Int & Radio. Gringo de nacimiento, chilango de corazón. https://t.co/m0R2HzUl8Y","media"
910,"media","no","media",TRUE,"Cindy_Banyai_FL","Host of Dr. Cindy Speaks on Big Mouth Media | 2022 Democratic Nominee US House of Representatives #FL19 #OurWater #OurHealth #OurCommunity | Official Page","media"
911,"media","no","media",TRUE,"sportsguymarv",":television:Journalism is MY :P button:urpose | https://t.co/XpY3zkFatW | Ω Ψ Φ :purple heart::high voltage:️ | 2x AP Award winning journo | LEHG:face with open mouth: | RTs aren’t endorsements|:round pushpin:478 :microphone: | :running shoe:head","media"
912,"media","no","media",TRUE,"CBSNews","Your source for original reporting and trusted news.

:television: CBS | Streaming on the CBS News app | @ParamountPlus","media"
914,"media","yes","media",TRUE,"wattsupbrent","Chief Meteorologist at WDBJ7.  Science communicator :Santa Claus: light skin tone:Christmas baby :backhand index pointing left: light skin tone:Southpaw:musical keyboard:Pianist :drum:Drummer:tumbler glass:Tea Obsessed:beach with umbrella:Travel:sailboat:️Paddling","media"
915,"media","no","media",TRUE,"NPR","News. Arts & Life. Music & more. This is NPR. :detective: Securely send us news tips: https://t.co/qfEoMDe1Hw","media"
916,"media","no","media",TRUE,"ABC6","ABC6 provides news coverage that connects Southern New Englanders to helpful, trustworthy, and balanced information about the issues impacting our community.","media"
917,"media","no","media",TRUE,"ajc","Our journalists can keep you informed with real, fact-based news because of subscribers. Learn more: https://t.co/VnIn1RLW28 

For News tips and FAQs: https://t.co/syAWi1x4IM","media"
918,"media","no","media",TRUE,"jadewalker","Journalist. Editor of A Bit of Good News. Previously @nytimes, @ap, @huffpost. I write and break news... mostly at night. She/her. https://t.co/sE3AS1GdTQ","media"
919,"media","no","media",TRUE,"Ellen_E_Clarke","Assistant Managing Editor for features, visuals and production. @Tb_Times. Top result when you Google permullet and okay with it.","media"
920,"media","no","media",TRUE,"McFeely_Inforum","Columnist for @inforum. Host of """"The Mike McFeely Mess"""" podcast. Tips: Open DMs or mmcfeely@forumcomm.com","media"
921,"media","no","media",TRUE,"MediaCamille","senior editor @CBSNews. founder of Write Knox Press. author of """"The Sweetest Fruit,"""" available @amazon. wife + #boymom. @michiganstateu grad. runner.","media"
922,"media","yes","media",TRUE,"annenbcnews","Chief Environmental Affairs Correspondent, NBC News. Proud alumna of the University of Notre Dame. Bostonian/Detroiter/Brussels ex-pat living in NYC.","media"
923,"media","yes","media",TRUE,"DaveOFox13","Morning meteorologist for Good Day Tampa Bay.","media"
924,"media","no","media",TRUE,"WAOW","Welcome to News 9 WAOW's Twitter account. Email your news tips to news@waow.com. News for you from Wausau and central Wisconsin.","media"
925,"media","yes","media",TRUE,"BrandonOrrWPLG","Certified broadcast meteorologist at @WPLGLocal10 in Miami, FL.","media"
926,"media","no","media",TRUE,"WPLGLocal10","South Florida News, Weather, Entertainment, Sports from WPLG Local 10 Follow us on Instagram: https://t.co/IIfr4MFhzm","media"
927,"media","no","media",TRUE,"nbc6","South Florida's trusted source for Breaking News, Weather and Traffic. Watch us LIVE, 24/7 the #NBC6 app.","media"
928,"media","no","media",TRUE,"RachelFine","Host of #FineTime & #AskHoward for Howard Stern's @HowardTV, cast of @travelchannel's #ParanormalPaparazzi, @HuffingtonPost writer, @GetShittens owner","media"
929,"media","no","media",TRUE,"fox6now","WITI-TV FOX6 News in Milwaukee. Our Twitter account is managed by the FOX6 News Digital Team. Have a news tip? E-mail fox6news@fox.com.","media"
930,"media","no","media",TRUE,"cnni","Breaking news from around the world, plus business, style, travel, sport and entertainment. We #gothere.","media"
931,"media","yes","media",TRUE,"CNNweather","When weather is the news, you can count on CNN's team of experienced meteorologists to bring it to you first. #CNNWeather","media"
932,"media","no","media",TRUE,"tvNewsChristina","•COO, J Comm,Inc•Director of Outreach & Awareness-Jordan’s Guardian Angels•Advocate•2x Emmy Award Winning Journalist•Former CBS13 Anchor•Wife & Mommy•","media"
933,"media","no","media",TRUE,"WNEMTV5news","WNEM TV5 News -- Coverage You Can Count On","media"
934,"media","no","media",TRUE,"TonyFrangieM","Venezuelan-Lebanese journalist and polisci (BU 21). Bylines: @Politico, @Business, @theEconomist, @ForeignPolicy, others. Subscribe to Venezuela Weekly :backhand index pointing down: light skin tone::mango:","media"
935,"media","no","media",TRUE,"FoxNews","Follow America's #1 cable news network, delivering you breaking news, insightful analysis, and must-see videos. https://t.co/sXA1eVB5Gv","media"
936,"media","no","media",TRUE,"JeffWeinerOS","@OrlandoSentinel local news director. Tortured Jets fan. UCF alum. Email: jeweiner@orlandosentinel.com. DM for Signal.","media"
937,"media","no","media",TRUE,"TCPalmHasert","Visuals multimedia journalist for Treasure Coast Newspapers and @TCPalm, Part of the @USATodayNetwork @gannett","media"
938,"media","no","media",TRUE,"codonnell_Times","Health and medicine reporter for The Tampa Bay Times and as English as fish and chips. Millwall, Celtic, Barcelona.","media"
939,"media","yes","media",TRUE,"mb_dahlstrom","Environment Editor @YahooNewsAU. Living on Gadigal land. Registered native bird carer. Views are my own. he/his michael.dahlstrom@yahooinc.com","media"
940,"media","no","media",TRUE,"tperry518","Former @CBSNews White House Reporter covering all things @VP | @uva ‘13 :blue heart::orange heart: perryti@cbsnews.com","media"
941,"media","no","media",TRUE,"jacksongosnell","19 y/o news guy. I help keep people informed. Visit my website!","media"
942,"media","no","media",TRUE,"PamelaFalk","CBS News Correspondent ~ J.D. ColumbiaLaw ~ CBS News-CBS Radio-CBS Sports ~ PhD NYU ~ Complutense UMadrid https://t.co/Fy3XtacpR7","media"
943,"media","yes","media",TRUE,"KristenWeather","Meteorologist @tmj4 in SE Wisconsin. Lover of cats. @ualr & @msstate graduate. @nwas Sealholder.","media"
944,"media","yes","media",TRUE,"Nate_HH","Meteorologist @SpecNews1Triad in Raleigh/Greensboro. Weather contributor/editor @DFITakeover. Weather geek, sports fanatic, proud FSU alum. CBM #653","media"
945,"media","no","media",TRUE,"alana_austin","Washington Correspondent for @GrayDCnews covering the White House & Congress for 91 TV markets","media"
946,"media","no","media",TRUE,"malbertnews","Chief National Investigative Correspondent, @HearstTV; Peabody Award winner; fmr @CBSNews; @SAGAFTRA; Mail: 1100 13th St NW 950, DC 20005; malbert@hearst.com","media"
948,"media","no","media",TRUE,"LEX18News","Count on LEX 18 News for the best news, weather, and sports coverage in central Kentucky. LEX 18 is the official station for Big Blue Nation!","media"
949,"media","no","media",TRUE,"CBS6","Local news and beyond. We’d love to hear your story. Please note content tagged @CBS6 may be used by WTVR and Scripps Co. in both on-air and online reporting.","media"
950,"media","no","media",TRUE,"jaketapper","Dad; husband; anchor of @TheLeadCNN & @CNNSOTU; Author of @TheOutpostbook, @TheHellfireClub, and The @Devil_May_Dance; long-suffering Philly sports fan","media"
951,"media","no","media",TRUE,"CNNValencia","@CNN Correspondent. @ATLPressClub TV Reporter of Year 2020 @USCAnnenberg Alum. Founder #LatinoMediaAllStars. Born & raised in NELA #EagleRock :eagle::latin cross:","media"
952,"media","no","media",TRUE,"cnnarabic","World Wide News Leader, in Arabic","media"
953,"media","no","media",TRUE,"NewsHour","PBS NewsHour is one of the most trusted news programs on TV and online.","media"
955,"media","no","media",TRUE,"AngelinaWTSP","Anchor/Reporter @10TampaBay | Find me Weekend #Brightside - Weekday #Nightside :television: | @EmersonCollege Alum | Hablo Español :flag: Dominican Republic: | :e-mail: ASalcedo@10TampaBay.com","media"
956,"media","no","media",TRUE,"MiamiNewTimes","Miami's independent source for news, criticism, culture, and more since 1987.","media"
957,"media","no","media",TRUE,"jimstinson","Reporter, writer, biz freelance. Former White House reporter. BSBA, Boston Univ., MAJ, Indiana Univ. ... RTs = news. First Amendment absolutist.","media"
958,"media","no","media",TRUE,"DavidsonHiers","In prog, “Bad Farmer”:rainbow: FL journo/horse fan :horse: • @EdWriters • @TheNation • @BitterSouth • @TheFlamingoMag • @TDonline • @USATODAY • Manage @Student_Bylines","media"
959,"media","no","media",FALSE,"WFLANews","Tampa Bay's latest news and information. Listen anywhere on @iheartradio.","media"
960,"other-agg","no","media",FALSE,"Tampa_Live","Enjoy the Tampa news.","media"
961,"media","no","media",FALSE,"SamPutterman","Covering misinformation @PolitiFact. Former: @Bradentonherald @TB_Times. Fan of dogs, coffee, news & dogs. Tips: sputterman@poynter.org","media"
962,"media","no","media",FALSE,"vdeanfla","Freelance writer and editor for @HeraldTribune, Bluegrass Unlimited and @RoughReadymedia. Loves news, bluegrass music, Tampa Bay Rays. Florida halfback.","media"
963,"media","yes","media",FALSE,"DanHenryWeather","Meteorologist at Metro Wx Service. M.S. Applied Meteorology @msstate. Seen/heard: @FloridaStorms, @SNNTV, @NPR Not @Fox4Weather but he seems nice","media"
964,"media","no","media",FALSE,"RBallogg","writing || curating the curious || news reporter and feature writer @BradentonHerald || Tips: rballogg@bradenton.com","media"
965,"media","no","media",FALSE,"ami_islander","Award-winning community weekly newspaper on Anna Maria Island, Fla. Best news since 1992.","media"
966,"media","no","media",FALSE,"UncensoredScoop","Covering news impacting Sarasota county, National news, and international news","media"
968,"media","yes","media",FALSE,"JustinMosely","WSNN-TV Chief Meteorologist, AMS Approved, Floridian, covering the weather for over a decade on Florida's Suncoast! @SNNTV","media"
969,"media","no","media",FALSE,"SamanthaSonner","Morning News Producer | @NewhouseSU Broadcast and Digital Journalist Alum | Always looking for a good story | RT's are not endorsements","media"
970,"media","no","media",FALSE,"ChristiWomack","Writer and editor @meetmiles, USF alumna & Bulls fan, proud Rotarian, vegetarian, advocate for black cats.","media"
971,"other-agg","no","media",FALSE,"FLNewsHeadlines","Trending news from The Sunshine State 
https://t.co/NSQnKqhTlB 
https://t.co/d5MDCptNyw","media"
972,"media","no","media",FALSE,"JakePetersonTV","News Director WXLV","media"
973,"media","yes","media",FALSE,"weatherchaser5","BS Atmospheric Science - Ohio State, Meteorologist, Storm Chaser, Structure Hipster, Photographer and lover of all things travel. Grand Optimist","media"
975,"other-agg","no","media",FALSE,"NewsUpdate24Ext","We bring news and information from many sources also here on extra. Warning: Ongoing News Are Developing And Information May Change When The Situation Calm Down","media"
976,"other-agg","no","media",FALSE,"photonuttt","We are flooded with liberal news everywhere, here is the flip side of the issues.","media"
981,"media","no","media",FALSE,"TB_TimesCurso","Photography Director of News & Sports for @TB_Times photojournalist, father, husband, grandfather and all around good guy. @csuf alum","media"
982,"media","no","media",FALSE,"ObserverGroup","Your source for neighborhood news in Sarasota/Siesta Key, Longboat Key and East County.

https://t.co/eaf1UvWH5L","media"
983,"media","no","media",FALSE,"felixveganews","Journalist | Legal Correspondent | Attorney | USF Criminology Graduate #GoBulls | Manhattan is my 2nd home | Raised in Florida | Born in Red Bank, New Jersey","media"
984,"media","no","media",FALSE,"JenniferKveglis","The K is silent :shushing face: • @NBC2/@ABC7 Reporter","media"
987,"media","yes","media",FALSE,"TampaBaysJulie","Wife|Dog Mom|Realtor|Meteorologist #ILoveTampaBay #AdoptDontShop","media"
988,"media","no","media",FALSE,"MelissaHarmon1","Emmy winning producer & storyteller. Loves public media, mangoes, & vintage Pyrex. Daughter of a garage sailing goddess. Rts & :red heart: ≠ endorsement","media"
