"","text","reply_settings","lang","author_id","id","conversation_id","possibly_sensitive","created_at.x","in_reply_to_user_id","verified","username","protected","location","description","created_at.y","name","profile_image_url","public_metrics.x_retweet_count","public_metrics.x_reply_count","public_metrics.x_like_count","public_metrics.x_quote_count","public_metrics.x_bookmark_count","public_metrics.x_impression_count","public_metrics.y_followers_count","public_metrics.y_following_count","public_metrics.y_tweet_count","public_metrics.y_listed_count","public_metrics.y_like_count","text_with_display_links","url","pinned_tweet_id"
"1","@brad_rando @thechriscorica @scottmelker We took rides up to Palm Harbor, etc. because the Red Tide doesn't make it up that far (very rare). Crowded up there....(the big roads)....my wife likes beach and I like sailing so at Minimum we'd like to be within 20 minutes of both.
Red Tide =much bigger deal than ""advertised""","everyone","en","1421881788536872960","1705660938660053181","1705259647655911699",FALSE,2023-09-23 19:10:32,"1565688833768833025",FALSE,"SocratesPoly",FALSE,"Sarasota County, FL","Truly do know most Everything. Polymath. Many moons of Experience. AMA (Twitter for 10+ years...quit for a while). If you knew who I was...","2021-08-01T17:14:25.000Z","Ardmore191","https://pbs.twimg.com/profile_images/1627479930668711936/iw94OkiI_normal.jpg",0,0,1,0,0,21,191,13,11629,10,140,"@brad_rando @thechriscorica @scottmelker We took rides up to Palm Harbor, etc. because the Red Tide doesn't make it up that far (very rare). Crowded up there....(the big roads)....my wife likes beach and I like sailing so at Minimum we'd like to be within 20 minutes of both.
Red Tide =much bigger deal than ""advertised""",NA,NA
"2","RT @ELSenviron: Save the date! The International Conference on Algal Biomass, Biofuels and Bioproducts (AlgalBBB 2024) will be held at Clearwater Beach, Florida from 10-12 June 2024 #algalbbb  . https   www elsevier com events conferences international conference on algal biomass biofuels and bioproducts. https   twitter com ELSenviron status 1704407551083716725 photo 1","everyone","en","397710938","1704437813364551797","1704437813364551797",FALSE,2023-09-20 10:10:16,NA,FALSE,"munialgal",FALSE,"Florida, USA","PhD Candidate University of Florida @UFSNRE researching organic matter cycling of non-point source pollution by harmful algae in the Tampa Bay area 🌊🌎🔬🥽","2011-10-25T02:04:33.000Z","Amanda Muni-Morgan","https://pbs.twimg.com/profile_images/1489679768417193992/HfSVnpQA_normal.jpg",1,0,0,0,0,0,60,352,77,0,NA,"RT @ELSenviron: Save the date! The International Conference on Algal Biomass, Biofuels and Bioproducts (AlgalBBB 2024) will be held at Clearwater Beach, Florida from 10-12 June 2024 #algalbbb https://t.co/W8fq5qnXft https://t.co/oL0JmIC8gZ","https://t.co/IB3BPIkeN5",NA
"3","Save the date! The International Conference on Algal Biomass, Biofuels and Bioproducts (AlgalBBB 2024) will be held at Clearwater Beach, Florida from 10-12 June 2024 #algalbbb  . https   www elsevier com events conferences international conference on algal biomass biofuels and bioproducts. https   twitter com ELSenviron status 1704407551083716725 photo 1","everyone","en","89719937","1704407551083716725","1704407551083716725",FALSE,2023-09-20 08:10:01,NA,FALSE,"ELSenviron",FALSE,"Amsterdam, Boston & Oxford","Follow us for earth & environmental science news, as well as info on our Books & Journals. For support with publishing please visit: https://t.co/y8iYRB3QmG","2009-11-13T15:18:30.000Z","Elsevier Environment","https://pbs.twimg.com/profile_images/877091786803621888/gG-VHbWa_normal.jpg",1,1,5,0,1,452,19593,900,11780,317,NA,"Save the date! The International Conference on Algal Biomass, Biofuels and Bioproducts (AlgalBBB 2024) will be held at Clearwater Beach, Florida from 10-12 June 2024 #algalbbb https://t.co/W8fq5qnXft https://t.co/oL0JmIC8gZ","https://t.co/pZXD2MQv8k",NA
"4","RT @PinellasGov: lead to algae blooms. Thanks to our dedicated staff who help protect our environment!  #PCPWK 2/2. https   pinellas gov pro    water quality monitoring program","everyone","en","1055539482","1692514597276619070","1692514597276619070",FALSE,2023-08-18 12:31:40,NA,FALSE,"MarkShark420",FALSE,"In Recovery","I’m a shark, I love baseball. 13.5 years sober from alcohol, I have Addison’s disease and I’m a medical marijuana patient. #RecoveryPosse #RIPDave","2013-01-02T16:44:25.000Z","MarkTheShark","https://pbs.twimg.com/profile_images/1191888511001153539/Q-hdJXyw_normal.jpg",1,0,0,0,0,0,1004,1129,123201,57,NA,"RT @PinellasGov: lead to algae blooms. Thanks to our dedicated staff who help protect our environment! https://t.co/qUo1Oq2squ #PCPWK 2/2",NA,"1008171908192448513"
"5","lead to algae blooms. Thanks to our dedicated staff who help protect our environment!  #PCPWK 2/2. https   pinellas gov pro    water quality monitoring program","everyone","en","87210710","1692506642447757346","1692295337031987451",FALSE,2023-08-18 12:00:03,"87210710",FALSE,"PinellasGov",FALSE,"Pinellas County, Florida","Pinellas County government's latest news, events, photos, video and general information. We're on the #GulfOfMexico and #TampaBay on the west coast of #Florida.","2009-11-03T15:10:56.000Z","Pinellas County","https://pbs.twimg.com/profile_images/958396908858429440/ZeXWz8mM_normal.jpg",1,0,3,0,0,423,29011,278,27198,464,NA,"lead to algae blooms. Thanks to our dedicated staff who help protect our environment! https://t.co/qUo1Oq2squ #PCPWK 2/2","https://t.co/Gt8840coE5",NA
