"","text","conversation_id","author_id","possibly_sensitive","in_reply_to_user_id","lang","reply_settings","id","created_at.x","username","verified","url","created_at.y","description","name","protected","location","profile_image_url","geo_place_id","public_metrics.x_retweet_count","public_metrics.x_reply_count","public_metrics.x_like_count","public_metrics.x_quote_count","public_metrics.x_impression_count","public_metrics.y_followers_count","public_metrics.y_following_count","public_metrics.y_tweet_count","public_metrics.y_listed_count","pinned_tweet_id"
"264","The respiratory stuff is definitely noticeable in Pinellas County. Scratchy throat and burning eyes have been the norm for over a week now. #redtide https://t.co/XEbx82bdpT","1418166854108000257","1186911",FALSE,"1186911","en","everyone","1418169825017356289",2021-07-22 11:23:29,"EricStoller",TRUE,"https://t.co/w4S3CBfM2U","2007-03-14T22:31:16.000Z","VP, Marketing and Digital Content at @TerritoriumLife","Eric Stoller",FALSE,"Delft, The Netherlands","https://pbs.twimg.com/profile_images/1562406445672439808/BW7ITMEE_normal.jpg","be21e5fe37cc6077",0,0,0,0,0,22838,2845,69012,1320,"1592874537200521227"
"265","@EricStoller Clearly, he never saw Jaws.","1418166854108000257","82289895",FALSE,"1186911","en","everyone","1418175152865652741",2021-07-22 11:44:39,"drewtorious",FALSE,NA,"2009-10-14T06:07:16.000Z","Proud Father | Professional Nerd | Gamer | Writer | Higher Ed Professional | Super Liberal | Lifelong Learner | D&D Dabbler | (he/they)","Drew Horner",FALSE,"United States","https://pbs.twimg.com/profile_images/1390013691152719876/JuEnJocx_normal.jpg",NA,0,0,1,0,0,204,1180,9925,3,"1593457209555488770"
"266","Somebody said Florida used to be great but now buildings are collapsing and having water pipe leaks.

I was like ""Florida's still great man"". A building collapse, hurricane, red tide, or whatever isn't gonna change that lol and also other areas exist in Florida besides Miami lol","1418206778773282816","396047154",FALSE,NA,"en","everyone","1418206778773282816",2021-07-22 13:50:19,"Aye_ItsDre",FALSE,NA,"2011-10-22T17:20:06.000Z","Please dont mention me, retweet me, quote me or anything if ur ugly. YOU'VE BEEN WARNED","Aye ' Im Andre . !",FALSE,"Chasing My Dreams","https://pbs.twimg.com/profile_images/738577956776247297/zv9yMdU3_normal.jpg","6d4de57fa00a913f",0,1,0,0,0,881,1490,45676,2,NA
"267","Miami, Fort Lauderdale, and the Keys gets hit by hurricanes the worse/mostly and people really think it's all of Florida when it's really not","1418206778773282816","396047154",FALSE,"396047154","en","everyone","1418206780039991302",2021-07-22 13:50:20,"Aye_ItsDre",FALSE,NA,"2011-10-22T17:20:06.000Z","Please dont mention me, retweet me, quote me or anything if ur ugly. YOU'VE BEEN WARNED","Aye ' Im Andre . !",FALSE,"Chasing My Dreams","https://pbs.twimg.com/profile_images/738577956776247297/zv9yMdU3_normal.jpg","6d4de57fa00a913f",0,0,0,0,0,881,1490,45676,2,NA
"268","@liliaballard check the red tide alerts","1417639587887960068","800570658929262592",FALSE,"41141829","en","everyone","1418325638650470402",2021-07-22 21:42:38,"chrislongview",FALSE,NA,"2016-11-21T05:24:53.000Z","Proud Montanan & Floridian. Huge nerd w/ a lab named Shelby. I raise lots of $ for stuff. Loves: Emory, Vanderbilt, Columbia, USF, beach, clearly a homo.","Florida Chris",FALSE,"Florida, USA","https://pbs.twimg.com/profile_images/1544507225846304768/gxbelS8D_normal.jpg","dc62519fda13b4ec",0,1,0,0,0,25984,2412,430931,89,"1283579763215532038"
"269","While #redtide is still laying waste to #tampabay there were some encouraging developments with regard to concentration levels this week. Find out more in my latest video y’all 🙏🏻 #redtidesucks #redtideflorida 

https://t.co/pexfAjUmHE https://t.co/sshq4hucWU","1418331974150860802","1360002869584355333",FALSE,NA,"en","everyone","1418331974150860802",2021-07-22 22:07:48,"WadeFishingExp",FALSE,"https://t.co/MVzN37qekF","2021-02-11T23:09:06.000Z","Tampa Bay’s premier wade fishing show, hosted by Matt Stevens, @stevens_mms. Tips, tactics and locations to help you catch more redfish, trout and snook.","The Wade Fishing Experience",FALSE,"Tampa, FL","https://pbs.twimg.com/profile_images/1411662349862375424/t7BMkf7A_normal.jpg","dc62519fda13b4ec",1,0,1,0,0,295,294,122,1,"1429080272264441857"
"270","Hey #annamaria @amichamber people — what’s the state of red tide on AMI beaches right now?","1418693316355493888","148753152",FALSE,NA,"en","everyone","1418693316355493888",2021-07-23 22:03:39,"PBoothMedia",FALSE,"https://t.co/SsucCcGjfV","2010-05-27T14:23:42.000Z","Writes stuff. Slappas da bass. Husband, dad, brother, son. @jazztimes @jazzizmagazine @flfilmcritics @jjajazzawards @theehsociety @acmejazzgarage https://t.co/GEOIL8x8Xv","Philip Booth",FALSE,NA,"https://pbs.twimg.com/profile_images/1616277942824222721/u6-SL1D__normal.jpg","dc62519fda13b4ec",0,1,0,0,0,2108,4280,57395,73,NA
"271","Red tide really fucked the plans up so cancelled the beach hotel got a place in downtown and we’ll just enjoy each other company 😌","1419181847146291200","1947884252",FALSE,NA,"en","everyone","1419181847146291200",2021-07-25 06:24:54,"beardedgunna",FALSE,NA,"2013-10-08T20:34:23.000Z","","E",FALSE,NA,"https://pbs.twimg.com/profile_images/1580434131288203264/NKgxZIQ3_normal.jpg","dc62519fda13b4ec",0,0,0,0,0,1036,463,45983,5,"1589623542781743104"
"272","I wanna personally thank Red Tide for ruining my summer. I was supposed to go all the time and now I can’t.","1419395153404497922","59687664",FALSE,NA,"en","everyone","1419395153404497922",2021-07-25 20:32:30,"Salinaxkensie",FALSE,NA,"2009-07-24T04:18:09.000Z","French fries, four lokos & all that shit. she/her","Salina",FALSE,"St Petersburg, FL","https://pbs.twimg.com/profile_images/1500564611409629184/3QE_xakg_normal.jpg","dc62519fda13b4ec",0,0,0,0,0,248,226,27650,2,"918172922518425602"
"273","@PBoothMedia You can always see live and up to date beach conditions, including red tide reports, right here:
https://t.co/vsAkuXob1D","1418693316355493888","343392474",FALSE,"148753152","en","everyone","1419628566342422532",2021-07-26 12:00:00,"amichamber",FALSE,"http://t.co/z6r34Esdvs","2011-07-27T14:16:23.000Z","Emerald waters, stunning sunsets, and a relaxed atmosphere makes us a must for your next destination!
Share all your local photos and videos with #MyAnnaMaria","Anna Maria Island Chamber",FALSE,"Anna Maria Island, Florida","https://pbs.twimg.com/profile_images/979536235608924162/ZHFZJwyH_normal.jpg",NA,0,1,0,0,0,2982,269,2092,41,"1451237392376074243"
"274","@RileyTermine @TB_Times So wait red tide now has a political affiliation?","1419478856625446913","1270894015261618180",FALSE,"1403351331084156933","en","everyone","1419677539476197380",2021-07-26 15:14:36,"LindaLush4",FALSE,NA,"2020-06-11T01:42:16.000Z","Educator by day and pirate by weekend. Most important job is being Payton and Tatum’s Noona. I support my LEO son. No DM’s please. #Catholic #Democrat","𝕷𝖎𝖓𝖉𝖆 𝕷𝖚𝖘𝖍",FALSE,"Tampa, FL","https://pbs.twimg.com/profile_images/1463930139755139081/WEjaGmsS_normal.jpg","dc62519fda13b4ec",0,0,0,0,0,1414,2457,40917,4,NA
"275","@SammiStitches Dead in the water, like the Red tides of Pinellas. You don't even need to cook the fish. They are dead before they hit the pan. ""Death DeSantis""","1419716891887738880","771090389046595584",FALSE,"477288141","en","everyone","1419719978723520512",2021-07-26 18:03:14,"Dontknowabtu",FALSE,NA,"2016-08-31T21:00:49.000Z","Fine Art and other National Treasures.","St. James the Greater.",FALSE,"Under ground bunker","https://pbs.twimg.com/profile_images/1363657051310862345/ypjW-kMl_normal.jpg","dc62519fda13b4ec",0,0,2,0,0,3805,4670,17553,3,"1144066266174566401"
"276","@StellaParton Put them in with the Red Tide.","1419292054623031297","771090389046595584",FALSE,"49151622","en","everyone","1419722809585119235",2021-07-26 18:14:29,"Dontknowabtu",FALSE,NA,"2016-08-31T21:00:49.000Z","Fine Art and other National Treasures.","St. James the Greater.",FALSE,"Under ground bunker","https://pbs.twimg.com/profile_images/1363657051310862345/ypjW-kMl_normal.jpg","dc62519fda13b4ec",0,0,0,0,0,3805,4670,17553,3,"1144066266174566401"
"277","Choosing hamburgers to ban since he has that Ben and Jerry's thing cleared up. Don't worry about the Red Tide and Covid cases. We've banned ice cream! #DeathSantis https://t.co/m4JZZyw4EF https://t.co/a84IpvD3Ym","1420131562226585606","1523811120",FALSE,NA,"en","everyone","1420131562226585606",2021-07-27 21:18:43,"coopgal69",FALSE,NA,"2013-06-17T03:36:33.000Z","Just a liberal girl living in a Florida World #DuranDuran #FreddieMercury  #CobraKai  #JosephQuinn #JoeKeery #StrangerThings #infp #RalphMacchio","Michelle Cooper",FALSE,"Florida, USA","https://pbs.twimg.com/profile_images/1613222181944565760/WImqECEF_normal.jpg","074d5ce471c43508",0,0,0,0,0,1149,695,26231,12,"1612956182741913602"
"278","Fishing during red tide? No, thanks. https://t.co/F6tTqz9iED","1420727903835328514","148753152",FALSE,NA,"en","everyone","1420727903835328514",2021-07-29 12:48:22,"PBoothMedia",FALSE,"https://t.co/SsucCcGjfV","2010-05-27T14:23:42.000Z","Writes stuff. Slappas da bass. Husband, dad, brother, son. @jazztimes @jazzizmagazine @flfilmcritics @jjajazzawards @theehsociety @acmejazzgarage https://t.co/GEOIL8x8Xv","Philip Booth",FALSE,NA,"https://pbs.twimg.com/profile_images/1616277942824222721/u6-SL1D__normal.jpg","dc62519fda13b4ec",0,0,1,0,0,2108,4280,57395,73,NA
"279","@KlutzCargo Hi!  I’m a reporter with Channel 10.   I’m reporting on red tide and the increase in flies.   Can I use your video?   Would you be willing to give me a call?","1419805494601035785","16977333",FALSE,"1087103908701454348","en","everyone","1420791648070549504",2021-07-29 17:01:40,"BeauWTSP",FALSE,NA,"2008-10-26T05:57:00.000Z","","-",FALSE,NA,"https://abs.twimg.com/sticky/default_profile_images/default_profile_normal.png","dc62519fda13b4ec",1,0,1,0,0,4926,0,2924,133,NA
"280","~ red tide and women’s rights for example","1420852733813346305","164889050",FALSE,"164889050","en","everyone","1420853020586303495",2021-07-29 21:05:32,"nothinkjustvibe",FALSE,"https://t.co/cvoZfUHxTu","2010-07-10T01:09:45.000Z","☯♑️🕊💜","jamie ❂",FALSE,"south jersey - tampa","https://pbs.twimg.com/profile_images/1250982278643232768/dWO-p7qp_normal.jpg","dc62519fda13b4ec",0,0,2,0,0,545,763,28490,2,"1468402780209664012"
"281","@gomer2323 It's cloudy, hot, humid, and we're having the WORST Red Tide case we've had in AGES. Hundreds of thousands of dead fish being scooped out of the water and shoveled off the beach. We also had over 800 manatees die, but NO Climate Change, right?! 🤨❣","1420851343242104834","2768977514",FALSE,"183085737","en","everyone","1420884105558900738",2021-07-29 23:09:04,"Kaiya1212",FALSE,NA,"2014-08-26T03:10:06.000Z","Writer; animal, nature, music, travel & language lover. Despise Cancer, Trump, Intolerance, & Pain. Pick the order!😾#WritingCommunity #WritersinQuarantine #FBR","Kaiya UNLEASHED 🕊",FALSE,"Lake Heather, FL","https://pbs.twimg.com/profile_images/998061882492706818/V4LQbOXP_normal.jpg","5bf268a34de4d516",0,2,1,1,0,22288,22394,102606,18,"1426938430198620172"
"282","Yeah, come on down to the Beautiful Sunshine State, y'all! Just get VAXXED, bring MASKS, don't expect Sunshine, and try not to get too sick from the TOXIC Red Tide. 😳😷💉🌊 Cough, cough! 🕶🤢🤮 https://t.co/PPMXNO2J1e","1420888754999513092","2768977514",FALSE,NA,"en","everyone","1420888754999513092",2021-07-29 23:27:32,"Kaiya1212",FALSE,NA,"2014-08-26T03:10:06.000Z","Writer; animal, nature, music, travel & language lover. Despise Cancer, Trump, Intolerance, & Pain. Pick the order!😾#WritingCommunity #WritersinQuarantine #FBR","Kaiya UNLEASHED 🕊",FALSE,"Lake Heather, FL","https://pbs.twimg.com/profile_images/998061882492706818/V4LQbOXP_normal.jpg","5bf268a34de4d516",1,0,1,0,0,22288,22394,102606,18,"1426938430198620172"
"283","Or a special legislative session on mitigating red tide, which destroys tourism. https://t.co/xLA0urGfWk https://t.co/iURwfDInKz","1421082283717627906","148753152",FALSE,NA,"en","everyone","1421082283717627906",2021-07-30 12:16:33,"PBoothMedia",FALSE,"https://t.co/SsucCcGjfV","2010-05-27T14:23:42.000Z","Writes stuff. Slappas da bass. Husband, dad, brother, son. @jazztimes @jazzizmagazine @flfilmcritics @jjajazzawards @theehsociety @acmejazzgarage https://t.co/GEOIL8x8Xv","Philip Booth",FALSE,NA,"https://pbs.twimg.com/profile_images/1616277942824222721/u6-SL1D__normal.jpg","dc62519fda13b4ec",0,0,0,0,0,2108,4280,57395,73,NA
"284","They putting little tables and stuff out now too. I don't think they're done yet tho cause they locked it back up lol. But I'm glad though cause Red Tide had me out the beaches lol. Either way this place has still been my peace https://t.co/XrhcQqdDdH","1421138140115374082","396047154",FALSE,NA,"en","everyone","1421138140115374082",2021-07-30 15:58:30,"Aye_ItsDre",FALSE,NA,"2011-10-22T17:20:06.000Z","Please dont mention me, retweet me, quote me or anything if ur ugly. YOU'VE BEEN WARNED","Aye ' Im Andre . !",FALSE,"Chasing My Dreams","https://pbs.twimg.com/profile_images/738577956776247297/zv9yMdU3_normal.jpg","6d4de57fa00a913f",0,0,0,0,0,881,1490,45676,2,NA
"285","No, wait! 😳 That's not what DeathSantis says! 🧐 In fact, Nursing Homes are now NOT allowed to report Covid-19 cases, we HAVE to get those Cruises going, and come enjoy the Red Tide! 😾 https://t.co/Usmoqc8Qdn","1421296751919738883","2768977514",FALSE,NA,"en","everyone","1421296751919738883",2021-07-31 02:28:46,"Kaiya1212",FALSE,NA,"2014-08-26T03:10:06.000Z","Writer; animal, nature, music, travel & language lover. Despise Cancer, Trump, Intolerance, & Pain. Pick the order!😾#WritingCommunity #WritersinQuarantine #FBR","Kaiya UNLEASHED 🕊",FALSE,"Lake Heather, FL","https://pbs.twimg.com/profile_images/998061882492706818/V4LQbOXP_normal.jpg","5bf268a34de4d516",0,0,1,1,0,22288,22394,102606,18,"1426938430198620172"
"286","@amp98765 @amichamber We were there until Wednesday. On the Anna Maria beach and on the bay side — no dead fish at all, no heavy odor. But several in our group, including me, could feel that telltale tickle/cough in our throats. Boaters told us they saw dead fish about a mile offshore.","1418693316355493888","148753152",FALSE,"19044378","en","everyone","1421422474319777792",2021-07-31 10:48:21,"PBoothMedia",FALSE,"https://t.co/SsucCcGjfV","2010-05-27T14:23:42.000Z","Writes stuff. Slappas da bass. Husband, dad, brother, son. @jazztimes @jazzizmagazine @flfilmcritics @jjajazzawards @theehsociety @acmejazzgarage https://t.co/GEOIL8x8Xv","Philip Booth",FALSE,NA,"https://pbs.twimg.com/profile_images/1616277942824222721/u6-SL1D__normal.jpg","dc62519fda13b4ec",0,1,0,0,0,2108,4280,57395,73,NA
"287","@amp98765 @amichamber Nothing wrong at all with wearing a mask.","1418693316355493888","148753152",FALSE,"19044378","en","everyone","1421442249217478662",2021-07-31 12:06:55,"PBoothMedia",FALSE,"https://t.co/SsucCcGjfV","2010-05-27T14:23:42.000Z","Writes stuff. Slappas da bass. Husband, dad, brother, son. @jazztimes @jazzizmagazine @flfilmcritics @jjajazzawards @theehsociety @acmejazzgarage https://t.co/GEOIL8x8Xv","Philip Booth",FALSE,NA,"https://pbs.twimg.com/profile_images/1616277942824222721/u6-SL1D__normal.jpg","dc62519fda13b4ec",0,0,1,0,0,2108,4280,57395,73,NA
"288","@44mmvvpp This pic is missing the thousands of pounds of dead fish rotting in our beaches due to pollution causing red tide algae blooms.","1421459163331416064","242013112",FALSE,"4451570595","en","everyone","1421684282326765568",2021-08-01 04:08:41,"melinacorazon11",FALSE,NA,"2011-01-23T18:38:24.000Z","💋🌎✨#NeverSayNever. #DoUntoOthers…#Resister, I am passionate, practical, a little spoiled and definitely damaged but a fighter and a good person.","MLBGY the Resista",FALSE,"Tampa, FL","https://pbs.twimg.com/profile_images/1455698061410377732/6uFx551V_normal.jpg","dc62519fda13b4ec",0,0,0,0,0,2245,3487,32461,2,NA
"289","This grouper sandwich taste like red tide","1421927239155847169","4376906067",FALSE,NA,"en","everyone","1421927239155847169",2021-08-01 20:14:06,"lordlightskin33",FALSE,NA,"2015-12-04T23:18:21.000Z","Can’t stop, won’t stop","BBB",FALSE,"St Petersburg, FL","https://pbs.twimg.com/profile_images/1473732558642896906/7fPvm04g_normal.jpg","dc62519fda13b4ec",0,0,3,0,0,317,580,955,1,NA
"290","Went out to Picnic Island and the American Legion to check for red tide damage yesterday. Full report is up now in my latest video. Appreciate y’all watching. #redtide #tampabay #fishing #waterquality #florida #snook #redfish #trout 

https://t.co/kJMwDUUTuL https://t.co/OlCSx5lVng","1422301500164952071","1360002869584355333",FALSE,NA,"en","everyone","1422301500164952071",2021-08-02 21:01:17,"WadeFishingExp",FALSE,"https://t.co/MVzN37qekF","2021-02-11T23:09:06.000Z","Tampa Bay’s premier wade fishing show, hosted by Matt Stevens, @stevens_mms. Tips, tactics and locations to help you catch more redfish, trout and snook.","The Wade Fishing Experience",FALSE,"Tampa, FL","https://pbs.twimg.com/profile_images/1411662349862375424/t7BMkf7A_normal.jpg","07d9db4c5b488000",1,0,1,0,0,295,294,122,1,"1429080272264441857"
"291","@MSNBC @ZeeshanAleem If only he would worry about the problems were facing in Florida and quit campaigning. We have Covid on the rise &amp; red tide Ravaging our shoreline.","1422350768032595975","1270894015261618180",FALSE,"2836421","en","everyone","1422352511101460480",2021-08-03 00:23:59,"LindaLush4",FALSE,NA,"2020-06-11T01:42:16.000Z","Educator by day and pirate by weekend. Most important job is being Payton and Tatum’s Noona. I support my LEO son. No DM’s please. #Catholic #Democrat","𝕷𝖎𝖓𝖉𝖆 𝕷𝖚𝖘𝖍",FALSE,"Tampa, FL","https://pbs.twimg.com/profile_images/1463930139755139081/WEjaGmsS_normal.jpg","dc62519fda13b4ec",1,0,1,0,0,1414,2457,40917,4,NA
"292","https://t.co/3cVvjf5gJB. A guess ice 🍦 🍦 is more important. https://t.co/UU8A4nWdF4","1422639833030316034","1888736366",FALSE,NA,"en","everyone","1422639833030316034",2021-08-03 19:25:42,"jahblessjones",FALSE,NA,"2013-09-21T03:28:33.000Z","Jones & Family Life is Good😁","Andrew Jones",FALSE,"Florida, USA","https://pbs.twimg.com/profile_images/1452381811577868300/k4oNwm4n_normal.jpg","01af119d415cd7d2",0,0,0,0,0,11,5,6058,0,NA
"293","@GovRonDeSantis you didn't help the counties that were begging you for help with the red tide. Your helping Floridians that want to leave their houses because of covid.  Now your not helping our children by letting them go to school Unmasked 

What are you doing?","1422729449263542272","1139310706199867397",FALSE,"1058807868","en","everyone","1422729449263542272",2021-08-04 01:21:48,"ehtampaDeb",FALSE,NA,"2019-06-13T23:16:54.000Z","Just a American wanting the best for America.Loves Horses,Cats & Dogs but only have a Cat.💙 💜 Go Bolts, Rays, Bucs & Rowdies & Wrexham
 No Dm's. No Drama!","Debbie",FALSE,"Tampa, FL","https://pbs.twimg.com/profile_images/1542305525488095232/hnUF7t_v_normal.jpg","dc62519fda13b4ec",0,0,0,0,0,1527,3240,7237,0,NA
"294","@fineout @GovRonDeSantis Red Tide Ron firmly believes that sucking up to the anti-vax, anti-mask Covid denier types will win him re-election and boost his presidential prospects. He will fight tooth &amp; nail against going in the right direction. #DeSantisVariant #RemoveRon #DeathSantis #RedTide","1422673504332353541","148753152",FALSE,"16001789","en","everyone","1422751610795593731",2021-08-04 02:49:52,"PBoothMedia",FALSE,"https://t.co/SsucCcGjfV","2010-05-27T14:23:42.000Z","Writes stuff. Slappas da bass. Husband, dad, brother, son. @jazztimes @jazzizmagazine @flfilmcritics @jjajazzawards @theehsociety @acmejazzgarage https://t.co/GEOIL8x8Xv","Philip Booth",FALSE,NA,"https://pbs.twimg.com/profile_images/1616277942824222721/u6-SL1D__normal.jpg","dc62519fda13b4ec",0,0,0,0,0,2108,4280,57395,73,NA
"295","@GovRonDeSantis That's why you let Piney Point dump massive amounts of contaminants into our water way causing red tide and not giving any State help into cleaning this mess up. Great move.  You are not a good Gov. You don't care about our water or children's health. I'm disappointed in you.","1422716680338350081","1139310706199867397",FALSE,"1058807868","en","everyone","1422760647587139585",2021-08-04 03:25:46,"ehtampaDeb",FALSE,NA,"2019-06-13T23:16:54.000Z","Just a American wanting the best for America.Loves Horses,Cats & Dogs but only have a Cat.💙 💜 Go Bolts, Rays, Bucs & Rowdies & Wrexham
 No Dm's. No Drama!","Debbie",FALSE,"Tampa, FL","https://pbs.twimg.com/profile_images/1542305525488095232/hnUF7t_v_normal.jpg","dc62519fda13b4ec",0,1,0,0,0,1527,3240,7237,0,NA
"296","@GovRonDeSantis Where's the help for Red Tide?  You have all this $$$ for others we need to stop killing our fish, dolphins, &amp; turtles. Clean up costs big bucks.  We need help!","1423026279113232386","1139310706199867397",FALSE,"1058807868","en","everyone","1423034280054345730",2021-08-04 21:33:05,"ehtampaDeb",FALSE,NA,"2019-06-13T23:16:54.000Z","Just a American wanting the best for America.Loves Horses,Cats & Dogs but only have a Cat.💙 💜 Go Bolts, Rays, Bucs & Rowdies & Wrexham
 No Dm's. No Drama!","Debbie",FALSE,"Tampa, FL","https://pbs.twimg.com/profile_images/1542305525488095232/hnUF7t_v_normal.jpg","dc62519fda13b4ec",1,0,1,0,0,1527,3240,7237,0,NA
"297","@EDF_Florida Florida @GOP lawmakers &amp; governors are too busy taking away the rights of communities to do what they think is right. Covid, plastics, red tide- they don’t care how they’re having a negative effect on communities.","1420831771814400009","1149410190141394944",FALSE,"1300505254375690241","en","everyone","1423320616308989957",2021-08-05 16:30:53,"PoliticsOyVey",FALSE,NA,"2019-07-11T20:08:39.000Z","Passionate mother tweeting about #politics #environment #democracy #HealthCare. Believer in #science #GoldenRule #endalz #ClimateChange #Resist #FTD #DACA","PoliticsOyVey",FALSE,NA,"https://abs.twimg.com/sticky/default_profile_images/default_profile_normal.png","dc62519fda13b4ec",0,0,1,0,0,68,449,4725,2,NA
"298","She doesn't live in FL. We do.. she does not know what the people know.  He doesn't want to give counties any help with RED TIDE. The Piney Point co that sent 223 million gallons of contaminated water into our bay with Deathsantis approval.  Now we have the worst Red Tide ever https://t.co/eiYFxcaEds","1423338291458367488","1139310706199867397",FALSE,NA,"en","everyone","1423338291458367488",2021-08-05 17:41:07,"ehtampaDeb",FALSE,NA,"2019-06-13T23:16:54.000Z","Just a American wanting the best for America.Loves Horses,Cats & Dogs but only have a Cat.💙 💜 Go Bolts, Rays, Bucs & Rowdies & Wrexham
 No Dm's. No Drama!","Debbie",FALSE,"Tampa, FL","https://pbs.twimg.com/profile_images/1542305525488095232/hnUF7t_v_normal.jpg","dc62519fda13b4ec",0,1,0,0,0,1527,3240,7237,0,NA
"299","@ehtampaDeb Yep and I Doubt she would send her child to public school with nobody wearing a mask and most people not vaccinated. If her kid was old enough to go to school and public school at that.","1423338291458367488","873201144251777024",FALSE,"1139310706199867397","en","everyone","1423355959481602052",2021-08-05 18:51:20,"Kelly123VT",FALSE,NA,"2017-06-09T15:32:30.000Z","Classic Rock News Politics, concerts, travel, R&B","Kelly",FALSE,"Florida, USA","https://pbs.twimg.com/profile_images/1251888871450738688/tdlmMRFB_normal.jpg",NA,0,1,1,0,0,24,269,7624,0,NA
"300","@Kelly123VT You really think she is even thinking of sending her kid to a public school..  No Way! That kid is going to be a spoiled brat just like her, maybe not that bad.
I like Meghan she just has some bad Rep. Ideas &amp; married a loser","1423338291458367488","1139310706199867397",FALSE,"873201144251777024","en","everyone","1423725023978737664",2021-08-06 19:17:51,"ehtampaDeb",FALSE,NA,"2019-06-13T23:16:54.000Z","Just a American wanting the best for America.Loves Horses,Cats & Dogs but only have a Cat.💙 💜 Go Bolts, Rays, Bucs & Rowdies & Wrexham
 No Dm's. No Drama!","Debbie",FALSE,"Tampa, FL","https://pbs.twimg.com/profile_images/1542305525488095232/hnUF7t_v_normal.jpg","dc62519fda13b4ec",0,0,0,0,0,1527,3240,7237,0,NA
"301","with what is going on in Florida, I hate to tell y'all that I still see license plates on cars, trucks, and vans from all y'alls states.

why are people letting their friends and family vacation here?

the weather is shitty and we have red tide, so the beach sucks.

stay home.","1424860401246916609","800570658929262592",FALSE,NA,"en","everyone","1424860401246916609",2021-08-09 22:29:26,"chrislongview",FALSE,NA,"2016-11-21T05:24:53.000Z","Proud Montanan & Floridian. Huge nerd w/ a lab named Shelby. I raise lots of $ for stuff. Loves: Emory, Vanderbilt, Columbia, USF, beach, clearly a homo.","Florida Chris",FALSE,"Florida, USA","https://pbs.twimg.com/profile_images/1544507225846304768/gxbelS8D_normal.jpg","dc62519fda13b4ec",38,29,258,3,0,25984,2412,430931,89,"1283579763215532038"
"302","@chrislongview Exactly ! I don’t understand it !","1424860401246916609","2502812062",FALSE,"800570658929262592","en","everyone","1424860742533124102",2021-08-09 22:30:48,"bbrae990",FALSE,NA,"2014-04-22T23:35:00.000Z","Music lover, activist and fighting to make the country better for the sake of my children , domestic violence survivor","🏳️‍⚧️🏳️‍🌈⚧💛 womans right are human rights",FALSE,"Maryland, USA","https://pbs.twimg.com/profile_images/1621370919774986241/_vpYo5t6_normal.jpg",NA,0,0,1,0,0,872,1104,42060,6,"1534335539930972160"
