"","text","conversation_id","author_id","possibly_sensitive","in_reply_to_user_id","lang","reply_settings","id","created_at.x","username","verified","url","created_at.y","description","name","protected","location","profile_image_url","geo_place_id","public_metrics.x_retweet_count","public_metrics.x_reply_count","public_metrics.x_like_count","public_metrics.x_quote_count","public_metrics.x_impression_count","public_metrics.y_followers_count","public_metrics.y_following_count","public_metrics.y_tweet_count","public_metrics.y_listed_count","pinned_tweet_id"
"180","NOW: @SenRickScott is meeting with Venezuelan community leaders in #Tampa as tension rises in that country. https://t.co/shIYLSB5zt","1094958833196285953","18753503",FALSE,"18753503","en","everyone","1094960805785812992",2019-02-11 14:06:14,"coreydavis6abc",FALSE,"https://t.co/6OczQSSujA","2009-01-08T04:25:03.000Z","📺 Reporter @6abc","Corey Davis",FALSE,"Philadelphia, PA","https://pbs.twimg.com/profile_images/1510626917371813894/UCchI5Q3_normal.jpg","07d9d22e5f484000",1,0,0,0,0,4291,4472,11147,104,"1510626972220727305"
"181","@WFLACorey @WFLA @SenRickScott Ask him about the Everglades pollution.","1094958833196285953","459890586",FALSE,"18753503","en","everyone","1094975385656311808",2019-02-11 15:04:10,"Derekmitti",FALSE,NA,"2012-01-10T04:56:07.000Z","social media Content creator | social media marketing | video | photography","Derek Mitti",FALSE,"Florida, USA","https://pbs.twimg.com/profile_images/1168557391643889664/CUNacVMO_normal.jpg",NA,0,1,1,0,0,350,633,3741,19,NA
"182","@Derekmitti @WFLA @SenRickScott I wish I had a chance to before he stopped taking questions. I do know that @GovRonDeSantis has been talking about environmental issues.","1094958833196285953","18753503",FALSE,"459890586","en","everyone","1094989394308710405",2019-02-11 15:59:50,"coreydavis6abc",FALSE,"https://t.co/6OczQSSujA","2009-01-08T04:25:03.000Z","📺 Reporter @6abc","Corey Davis",FALSE,"Philadelphia, PA","https://pbs.twimg.com/profile_images/1510626917371813894/UCchI5Q3_normal.jpg",NA,0,0,1,0,0,4291,4472,11147,104,"1510626972220727305"
"183","I am now in FL from Ca heartbroken now I get to work 6 hours as a cashier with one 15 min break and I now I have no insurance &amp; looking forward to watching the red tide while my neighbors continue to use roundup on their yards @cspanwj","1096402282990759937","314585532",FALSE,NA,"en","everyone","1096402282990759937",2019-02-15 13:34:09,"lynn_holly",FALSE,NA,"2011-06-10T14:01:45.000Z","58y/o retired RN &  preschool teacher think that poverty healthcare homelessness are moral issues to care for each other/planet and self knowledge is our job","Lynn",FALSE,"tallahassee fl","https://pbs.twimg.com/profile_images/968162529246523397/BcBZVGhd_normal.jpg","dc62519fda13b4ec",0,0,0,0,0,103,211,16775,6,NA
"184","@SenRickScott @SpeakerPelosi You didn’t go to Laredo to raise funds Red Tide Rick. You just went to Washington D.C. to throw a “Black Tie” fundraiser after you were sworn in as new FL Senator while 800,000 federal workers didn’t get a paycheck during the government shutdown!","1096535942943461376","524375594",FALSE,"131546062","en","everyone","1096542219597737984",2019-02-15 22:50:12,"tonyedl",FALSE,NA,"2012-03-14T13:54:49.000Z","Navy Veteran","tonyedl",FALSE,"Florida, USA","https://pbs.twimg.com/profile_images/1610490812298665984/koxq80ME_normal.jpg","70b7be4d968912d3",2,0,6,0,0,184,119,22985,3,NA
"185","Red tide discount https://t.co/FArPnIpeKZ","1097250477157294080","20925907",FALSE,NA,"en","everyone","1097250477157294080",2019-02-17 21:44:34,"SlimROZAY",FALSE,NA,"2009-02-15T18:18:59.000Z","drink more water & mind yours 🧚🏽‍♀️ IG: luhbootyjas","JT",FALSE,NA,"https://pbs.twimg.com/profile_images/1480034157795368962/cH5vYur7_normal.jpg","9e27ffe7ca397c0a",0,0,1,0,0,1904,705,154040,14,NA
"186","@AmericaNewsroom @SenRickScott @SandraSmithFox Red Tide Rick supports a manufactured crisis to divert money from our military to build a “campaign promised” border wall that experts agree will not do anything to solve our immigration problem. Why doesn’t Scott work on bipartisan immigration legislation that works?","1097870542517035009","524375594",FALSE,"312800783","en","everyone","1097901567196516353",2019-02-19 16:51:46,"tonyedl",FALSE,NA,"2012-03-14T13:54:49.000Z","Navy Veteran","tonyedl",FALSE,"Florida, USA","https://pbs.twimg.com/profile_images/1610490812298665984/koxq80ME_normal.jpg","70b7be4d968912d3",0,0,0,0,0,184,119,22985,3,NA
"187","@SenRickScott @AmericaNewsroom Stop creating your own “Alternative Facts” Red Tide Rick. All Democrats are not Socialists and all socialist ideas are not dangerous! Or are you against Social Security, Medicare and Medicaid? Floridians already know you’re against Medicaid expansion!","1097941378481278977","524375594",FALSE,"131546062","en","everyone","1098007065967161344",2019-02-19 23:50:59,"tonyedl",FALSE,NA,"2012-03-14T13:54:49.000Z","Navy Veteran","tonyedl",FALSE,"Florida, USA","https://pbs.twimg.com/profile_images/1610490812298665984/koxq80ME_normal.jpg","70b7be4d968912d3",0,0,0,0,0,184,119,22985,3,NA
"188","@SenRickScott @SenateAging Here we go again! Red Tide Rick NOW says he wants to protect seniors! Where was he as Florida’s Governor when he failed to enforce backup generators for nursing homes to protect from power outages during hurricanes? Why did he delete public texts after Hollywood Hills disaster?","1097953549936480256","524375594",FALSE,"131546062","en","everyone","1098010850646986753",2019-02-20 00:06:01,"tonyedl",FALSE,NA,"2012-03-14T13:54:49.000Z","Navy Veteran","tonyedl",FALSE,"Florida, USA","https://pbs.twimg.com/profile_images/1610490812298665984/koxq80ME_normal.jpg","70b7be4d968912d3",0,0,1,0,0,184,119,22985,3,NA
"189","@SenRickScott @USDOT Red Tide Rick rejected $2.4B in federal funds for high speed rail in 2011. Then his last year as FL governor he reverses course &amp; invests $3M in All Aboard Florida, a Coral Gables inter-city rail company &amp; heavy contributor to Scott’s campaign!","1098011868038422528","524375594",FALSE,"131546062","en","everyone","1098066860485103616",2019-02-20 03:48:35,"tonyedl",FALSE,NA,"2012-03-14T13:54:49.000Z","Navy Veteran","tonyedl",FALSE,"Florida, USA","https://pbs.twimg.com/profile_images/1610490812298665984/koxq80ME_normal.jpg","70b7be4d968912d3",1,0,7,1,0,184,119,22985,3,NA
"190","A great presentation from Michelle Johnson last night! We learned a little history about our Earth, what red tide is and some of the potential causes. 🌎 🌡

#Tampa #science #redtide… https://t.co/tJ6m4yaqth","1098581670406455296","2368108578",FALSE,NA,"en","everyone","1098581670406455296",2019-02-21 13:54:15,"TampaDiving",FALSE,"http://t.co/KJ3sT5ZuGe","2014-03-02T02:53:19.000Z","South #Tampa full-service dive shop classes, servicing, trips and a full range of scuba gear! #diving #scuba #snorkel #freediving #spearfishing 813-832-6669","Adventure Outfitters",FALSE,"4316 S Manhattan Ave Tampa, FL","https://pbs.twimg.com/profile_images/908698312840114177/rJ-bPAAL_normal.jpg","dc62519fda13b4ec",0,0,0,0,0,266,304,1176,16,NA
"191","@SenRickScott Red Tide Rick and Republicans are politicizing a controversial subject for their own benefit! This legislation is based on lies and a misinformation campaign, aimed at shaming women and criminalizing doctors for a practice that doesn’t exist in medicine or reality.","1100177302825193473","524375594",FALSE,"131546062","en","everyone","1100428002314371074",2019-02-26 16:10:55,"tonyedl",FALSE,NA,"2012-03-14T13:54:49.000Z","Navy Veteran","tonyedl",FALSE,"Florida, USA","https://pbs.twimg.com/profile_images/1610490812298665984/koxq80ME_normal.jpg","70b7be4d968912d3",0,0,0,0,0,184,119,22985,3,NA
"192","Not in the Tampa Bay region. Snook &amp; red fish are closed due to red tide. https://t.co/d4j05r3ZcR","1101207013101576200","6187652",FALSE,NA,"en","everyone","1101207013101576200",2019-02-28 19:46:26,"miklb",FALSE,"https://t.co/2HPFaCKjXc","2007-05-21T01:53:23.000Z","I know what’s wrong with your website.  Food, music, the open web.  he/him Fediverse @michael@michaelbishop.me","Michael Bishop",FALSE,"The old fishing hole.","https://pbs.twimg.com/profile_images/1568288046952464385/F5JmNYYA_normal.jpg","dc62519fda13b4ec",0,0,0,0,0,923,1357,57694,106,"796423262196682752"
"193","@SenRickScott @AOC Red Tide Rick has “Trumpitis”, inflating his record as governor again. But to his credit, Florida has the best staffed McDonalds and Burger Kings in the country!","1102683298940239873","524375594",FALSE,"131546062","en","everyone","1102935461268463618",2019-03-05 14:14:40,"tonyedl",FALSE,NA,"2012-03-14T13:54:49.000Z","Navy Veteran","tonyedl",FALSE,"Florida, USA","https://pbs.twimg.com/profile_images/1610490812298665984/koxq80ME_normal.jpg","70b7be4d968912d3",0,0,1,0,0,184,119,22985,3,NA
"194","WE’RE BACK!! 

Tonight we’ll be discussing Tampa’s mayoral election!! 

Also we will be joined in the studio by @RLundark of the Red Tide Party and 2016 Democratic Primary nominee Jim Webb! 

All with music from The Mak Brothers Band! 

TONIGHT! 8 PM ON https://t.co/9vxWoJ9VHh","1103009371347472384","3523992621",FALSE,NA,"en","everyone","1103009371347472384",2019-03-05 19:08:21,"TheLocalHour",FALSE,"https://t.co/JSApciOAMQ","2015-09-02T14:22:37.000Z","""The Local Hour"" LIVE! Every Tuesday @ 8 pm on https://t.co/2FKD3uMZP9 📻 Tampa's #1 radio show for local music & comedy! 
Old Shows:
https://t.co/kn6AN3LfiI","The Local Hour!",FALSE,"Tampa, FL","https://pbs.twimg.com/profile_images/1009859167115513861/rPM-ZD2F_normal.jpg","dc62519fda13b4ec",2,0,0,0,0,59,38,145,2,"958163006852091905"
"195","OK. So now we know Red Tide Rick’s real mission in D.C....Talk about how dysfunctional Washington is, introduce Term Limits and act as President Trump’s Toadie! Why didn’t you comment or censure Steve King for his White Nationalism support? https://t.co/A20cQiBPFO","1103457496943992832","524375594",FALSE,NA,"en","everyone","1103457496943992832",2019-03-07 00:49:03,"tonyedl",FALSE,NA,"2012-03-14T13:54:49.000Z","Navy Veteran","tonyedl",FALSE,"Florida, USA","https://pbs.twimg.com/profile_images/1610490812298665984/koxq80ME_normal.jpg","70b7be4d968912d3",0,0,0,0,0,184,119,22985,3,NA
"196","So why are Red Tide Rick and the GOP silent about other despots like Saudi Arabia for blatant murder of U.S. journalist Khoshogee or kidnap &amp; torture of U.S. Dr. Fitaihi? https://t.co/nWnqHBZp7Q","1103693125237776384","524375594",FALSE,NA,"en","everyone","1103693125237776384",2019-03-07 16:25:21,"tonyedl",FALSE,NA,"2012-03-14T13:54:49.000Z","Navy Veteran","tonyedl",FALSE,"Florida, USA","https://pbs.twimg.com/profile_images/1610490812298665984/koxq80ME_normal.jpg","70b7be4d968912d3",0,0,0,0,0,184,119,22985,3,NA
"197","@SenRickScott @marcorubio And that’s why you’ll always be known as Red Tide Rick. You didn’t do anything to improve the environment in Florida during 8 yrs as governor! Your budget cuts to the FL dept of environmental protection &amp; water management helped fuel green algae in St. Lucie &amp; Ft. Myers!","1105909571569311745","524375594",FALSE,"131546062","en","everyone","1105914499050164224",2019-03-13 19:32:18,"tonyedl",FALSE,NA,"2012-03-14T13:54:49.000Z","Navy Veteran","tonyedl",FALSE,"Florida, USA","https://pbs.twimg.com/profile_images/1610490812298665984/koxq80ME_normal.jpg","70b7be4d968912d3",0,0,3,0,0,184,119,22985,3,NA
"198","Excited that our great friend @inspectorplanet was highlighted yesterday on @WFLA speaking about red tide and other marine ecology. We look forward to her being with us at the @nselascience 2019 Summer Leadership Institute 🚀🚀🚀 @MoteMarineLab @nsta https://t.co/pistyVU5Nq","1106487215486631936","708281887383527424",FALSE,NA,"en","everyone","1106487215486631936",2019-03-15 09:28:04,"TampaBaySTEM",FALSE,"https://t.co/8hOeCQ0dCY","2016-03-11T13:22:16.000Z","Network of collaborating organizations in Tampa Bay, preparing students for success in STEM and creating a better community for all! 🔬🚀⚙️📐","TampaBaySTEM",FALSE,"Tampa, FL","https://pbs.twimg.com/profile_images/1106648985165619206/BjolO0QT_normal.jpg","dc62519fda13b4ec",0,0,0,0,0,3304,2132,3640,44,NA
"199","@JohnnyBshow didn't get to hear much,  was at #BobSegerFInalTour , but jumped in w/ @AnnaHummelRadio asking to call in and say how long it is,  a listner explaining how #ballsmashing is worse then #RedTide and heard @JohnnyBcomedy talking about #Balldipping LuvYall CYa Sunday","1106762844744372224","2679751243",FALSE,"236217439","en","everyone","1106762844744372224",2019-03-16 03:43:19,"ZaqCarGuy",FALSE,"https://t.co/PytHma5YhX","2014-07-25T14:25:58.000Z","I am a sales manager at Reeves Import Motorcars in Tampa, Fl. I have a great knowledge of the Automotive industry & work at the greatest dealership!","Zaqueray Berridge",FALSE,"Regal Lakeland , Fl","https://pbs.twimg.com/profile_images/1163137269932445697/knz-GG4l_normal.jpg","dc62519fda13b4ec",0,0,2,0,0,159,430,160,3,NA
"200","@kristenwaksman All hands on deck for wastewater. Red tide presentations at @floridaaquarium &amp; @USFCMS  speak about nutrient management needs. With you &amp; @ifetayovenner and @USRepKCastor in Tampa Bay -
we should bring folks together and move on solutions. @EngineeringUSF @strongcoasts  @cprout1","1116850365297721344","26883873",FALSE,"14285986","en","everyone","1116877502549458944",2019-04-13 01:35:21,"matrotz",FALSE,"https://t.co/lH030ffTqI","2009-03-26T23:18:17.000Z","everyday person. educator. environmental engineer. Professor, USF; Past President, AEESP; Board Member, Fragments of Hope Corp. Views are mine alone.","Maya Trotz",FALSE,"Tampa, FL","https://pbs.twimg.com/profile_images/1567502537921536001/uFjfLKEj_normal.jpg","dc62519fda13b4ec",1,1,6,0,0,1974,2097,7442,44,"1312260476781424640"
"201","COMING UP 6PM #PMTampaBay @WFLANews FL Senate passes bill to arm teachers, Manatee road rage killing, Broward deputy under fire over pepper-spraying video, @USouthFlorida researcher on cause of Red Tide, Tampa Mayor Elex Results @ryanegorman @onairmorgan @jamesburlander","1120807013683011586","244335323",FALSE,NA,"en","everyone","1120807013683011586",2019-04-23 21:49:50,"felixveganews",FALSE,NA,"2011-01-29T02:36:05.000Z","Journalist | Legal Correspondent | Attorney | USF Criminology Graduate #GoBulls | Manhattan is my 2nd home | Raised in Florida | Born in Red Bank, New Jersey","@FelixVegaNews",FALSE,"Tampa","https://pbs.twimg.com/profile_images/1218373477155078144/KMiQrFcC_normal.jpg","dc62519fda13b4ec",1,0,0,0,0,891,2809,12834,24,NA
"202","Enjoyed the opportunity to be on the science/engineer panel to discuss mitigation options for red tide at yesterday's @SRQCountyGov Water Quality Summit. @UF_IFAS #WaterWednesday https://t.co/Tu9TF5prpL","1136671299286306816","784048897438146560",FALSE,NA,"en","everyone","1136671299286306816",2019-06-06 16:28:50,"UF_MaryLusk",FALSE,NA,"2016-10-06T15:13:19.000Z","Univ Florida Assistant Prof of Soil and Water Sciences, mom of 3 great boys, stormwater chaser, urban biogeochemist, Mormon woman, Floridian","Dr. Mary Lusk",FALSE,NA,"https://pbs.twimg.com/profile_images/784168001553756160/TMJn-mTX_normal.jpg","dc62519fda13b4ec",2,1,13,0,0,552,108,486,13,NA
"203","@UF_MaryLusk @SRQCountyGov @UF_IFAS Thank you for attending and for your work to help our waters!","1136671299286306816","33224498",FALSE,"784048897438146560","en","everyone","1137047871906287621",2019-06-07 17:25:12,"EllieDecker",FALSE,NA,"2009-04-19T15:26:04.000Z","Retired business owner who feels protective over the vulnerable. The vulnerable are Seniors, Disabled, and Children.","Ellie Decker",FALSE,"Florida","https://pbs.twimg.com/profile_images/1367245052494422022/s-chiYFR_normal.jpg",NA,0,0,0,0,0,76,131,296,0,NA
"204","Saharan dust could enhance red tide and provide fewer storms in Bay Area https://t.co/16xaE9K3Up","1144139647938912256","1565900304",FALSE,NA,"en","everyone","1144139647938912256",2019-06-27 07:05:23,"WFLAMelissaM",TRUE,"https://t.co/YfnLXsO7KM","2013-07-03T14:30:48.000Z","Reporter/Anchor @WFLA NBC covering Tampa, Florida | Pennsylvania native | lover of ☀️ | Retweets ≠ endorsements | Story idea? Message me!","Melissa Marino",FALSE,"Tampa, FL","https://pbs.twimg.com/profile_images/1459224454442233856/dFHtmhyb_normal.jpg","dc62519fda13b4ec",0,0,1,0,0,4180,1464,11299,89,NA
"205","@DiamondandSilk I just hope these forgotten US citizens remember at the polls how the #democrats put illegal immigrants needs ahead of theirs. #redtide #KAG2020","1149788095119859717","548145982",FALSE,"2908170952","en","everyone","1149795303266095105",2019-07-12 21:38:57,"fl_bob",FALSE,NA,"2012-04-08T04:45:43.000Z","Just an Old White Man #OWM","BWilliams",FALSE,NA,"https://pbs.twimg.com/profile_images/1095440735149670401/tJ-UMtub_normal.jpg","5bf268a34de4d516",0,0,0,0,0,18,99,3518,1,NA
"206","I have a date tonight.  It’s with a girl.  I guess I’m having clam tonight. “I don’t eat seafood because of the red tide”.  #allergictoseafood #datenight #mynattmess #guerreroglam #sisterswhoscissor #columbiarestaurant #dinnerdate #fridaynight #floridagirls #813","1152338865061019648","14568636",FALSE,NA,"en","everyone","1152338865061019648",2019-07-19 22:06:09,"ctguerrero",FALSE,"https://t.co/JkW2JfjM1P","2008-04-28T12:42:26.000Z","just a guy looking at stuff. Jackie Daytona is my alter-ego #readingisfundemental  Frmr Tampa Improv Mgr now FOH Floridan Palace","Christopher Guerrero",FALSE,"Tampa, FL","https://pbs.twimg.com/profile_images/1187541115144155137/-9ctQxTH_normal.jpg","dc62519fda13b4ec",0,0,1,0,0,204,759,3611,1,NA
"207","Yeah we have craft beer but sometimes its fun to throw the pinky out and enjoy a mixed drink on a hot summer day.
Blue Hawaiian or a Red Tide 
You decide.......
#anclotebrewtarponsprings #anclotebrew #craftbeer #mixedDrinks #hawaiian #redtide #tarponsprings #tarponspringsflorida https://t.co/UxvMKQPBr9","1153710622175105024","936372113484763136",FALSE,NA,"en","everyone","1153710622175105024",2019-07-23 16:57:01,"Anclote_Brew",FALSE,"https://t.co/Go04g0Izbe","2017-11-30T23:11:23.000Z","Tarpon Springs Craft Tap House that features gourmet grilled cheese sandwiches, live entertainment & locally crafted brews!","Anclote Brew",FALSE,"Tarpon Springs, FL","https://pbs.twimg.com/profile_images/936996666242199552/P2EOo8T9_normal.jpg","dc62519fda13b4ec",0,0,0,0,0,22,14,591,0,NA
"208","@MacChrystal @michaelgayetsky Youngstown’s version of Red Tide?","1163960618996686849","25422773",FALSE,"42873293","en","everyone","1163963093447270401",2019-08-20 23:56:41,"Davey074",FALSE,NA,"2009-03-20T00:42:48.000Z","Youngstown - Cleveland - Tampa","Dave Yanek",FALSE,"Tampa, FL","https://pbs.twimg.com/profile_images/1059079132645126144/cIYQ2c9f_normal.jpg","dc62519fda13b4ec",0,0,1,0,0,71,305,5141,1,NA
"209","According to the report, red tide was a result of septic tank failures and urban runoff that consisted of human and pet waste. Stop this &amp; leave straws alone. This will kill all animals.
https://t.co/tn9IXNTUzu","1173074224329756673","398399733",FALSE,NA,"en","everyone","1173074224329756673",2019-09-15 03:21:04,"DianeWestcott",FALSE,NA,"2011-10-26T00:43:52.000Z","married - 
USA 🇺🇸❤
- My family have served since WW2","Diane Westcott",FALSE,"Tampa, FL","https://pbs.twimg.com/profile_images/796975483376304129/OIwvlV6-_normal.jpg","51264211e147d635",0,0,0,0,0,36,236,8459,0,NA
"210","Really hope it doesn’t come north. We don’t need another round of #redtide in #SarasotaBay or #TampaBay https://t.co/vcbyDUg0is","1180605828879048704","131274413",FALSE,NA,"en","everyone","1180605828879048704",2019-10-05 22:08:58,"KRKemp",FALSE,"https://t.co/htgnZU1qFC","2010-04-09T20:08:40.000Z","Husband & father of 2 adopted boys. Outdoorsman. Racing fan. Purdue Boilermaker.","Kevin Kemp",FALSE,"Lithia FL","https://pbs.twimg.com/profile_images/1149006195526688769/dMmKtJCY_normal.jpg","017a309d07f2b3f8",0,0,0,0,0,229,876,1762,5,"1006616316600569857"
"211","I’m happy to report that the redfish population in Tampa Bay is making a rebound after last year’s red tide. https://t.co/4rqBRKkYSv","1188787953272795137","6187652",FALSE,NA,"en","everyone","1188787953272795137",2019-10-28 12:01:49,"miklb",FALSE,"https://t.co/2HPFaCKjXc","2007-05-21T01:53:23.000Z","I know what’s wrong with your website.  Food, music, the open web.  he/him Fediverse @michael@michaelbishop.me","Michael Bishop",FALSE,"The old fishing hole.","https://pbs.twimg.com/profile_images/1568288046952464385/F5JmNYYA_normal.jpg","dc62519fda13b4ec",0,0,1,0,0,923,1357,57694,106,"796423262196682752"
"212","@realDonaldTrump is going to eat the #Democrats alive and expose your party 4 what it really is. #Socialist and want to over throw the 2016 election. #Redtide BTW #YourFired https://t.co/3s1deIaICX","1190090148173750272","548145982",FALSE,"25073877","en","everyone","1190090148173750272",2019-11-01 02:16:16,"fl_bob",FALSE,NA,"2012-04-08T04:45:43.000Z","Just an Old White Man #OWM","BWilliams",FALSE,NA,"https://pbs.twimg.com/profile_images/1095440735149670401/tJ-UMtub_normal.jpg","2cce4a9792d2d92e",0,0,0,0,0,18,99,3518,1,NA
"213","@GregJnFla And it’s not about the hot weather either cause the season been cooling down! So whatever cycle of red tide it’s not necessarily all about extreme heat as was thought last year","1195308410595692545","905841483852513280",FALSE,"738372419182821376","en","everyone","1195309601157263361",2019-11-15 11:56:31,"featherman_bill",FALSE,NA,"2017-09-07T17:13:34.000Z","NO DM’s ! ! trying to live a simple life, with my loving @goatgirl1976 !!!!  https://t.co/lYVvQLdJ7A known to be 50/50 asshole n more asshole","Shaggg2016",FALSE,"Tampa, FL","https://pbs.twimg.com/profile_images/1614586039846191104/bl38Z-I0_normal.jpg","dc62519fda13b4ec",0,0,1,0,0,984,1867,23625,9,"1352931198272679936"
"214","We have Gaetz and guns, red tide and racism but when I see #snowstorm trending it reminds my why I moved to Florida!

#flipFLBlue
#ImpeachDonaldTrumpNOW
#GOPComplicitTraitors https://t.co/M8Lqz03Elr","1199371594784747520","42253358",FALSE,NA,"en","everyone","1199371594784747520",2019-11-26 16:57:26,"antiqueK",FALSE,NA,"2009-05-24T18:11:25.000Z","Soul of a mermaid mouth of a sailor. 
#guncontrol #atheist","🌊AntiqueK🌻",FALSE,"New York, USA","https://pbs.twimg.com/profile_images/1523315831211446273/Bychq83j_normal.jpg","dc62519fda13b4ec",0,0,2,0,0,8076,8049,11061,1,"1292188081739706369"
"215","Red tide and booze puke https://t.co/1J1I1Qi5vn","1202300462659198976","262025657",FALSE,NA,"en","everyone","1202300462659198976",2019-12-04 18:55:42,"matteblackeye",FALSE,NA,"2011-03-07T05:29:04.000Z","38 they/them non-binary Nameless, Formless on tumblr. married to @myndcryme56 (unfortunate for him)","Bunny 🐰",FALSE,"New York","https://pbs.twimg.com/profile_images/1618012107882078208/PBki5Rly_normal.jpg","dc62519fda13b4ec",0,0,5,0,0,1184,1183,23221,4,"1615543644173340673"
"216","@edsbs Also the beaches alternate between having necrotizing fasciitis and red tide every other month","1219328781263032320","318024492",FALSE,"7452872","en","everyone","1219331690750971912",2020-01-20 18:51:43,"_zachferguson",FALSE,NA,"2011-06-15T21:00:43.000Z","#RollTide","Zach Ferguson",FALSE,"Tampa, FL","https://pbs.twimg.com/profile_images/1275080361886670850/RiEhq-NI_normal.jpg","01af119d415cd7d2",0,0,6,0,0,213,129,11231,10,NA
"217","From Red Tide to #RollTide https://t.co/jyFOqy3Mc2","1229809368033628160","109240047",FALSE,NA,"en","everyone","1229809368033628160",2020-02-18 16:46:16,"TylerGraddy",FALSE,"https://t.co/2vfPysntu5","2010-01-28T12:02:51.000Z","Jack of All Trades, Master of Fun","Tyler Graddy",FALSE,"Tampa Bay, FL | Orlando, FL","https://pbs.twimg.com/profile_images/1324152152894382089/fUSL5VbI_normal.jpg","dc62519fda13b4ec",0,0,0,0,0,862,973,4724,11,NA
"218","@xmethuselahx @Pneumatic123 @Bayou_Bengals @GOPChairwoman @EricTrump Yep.  Need that red tide.  I like a government that tells me what to do and how to think and then, if I disagree, they add me to a Trump hit list.  Very comforting.","1232512668533239808","1548980701",FALSE,"102415827","en","everyone","1233113117854441477",2020-02-27 19:34:12,"floridablue97",FALSE,NA,"2013-06-26T19:45:05.000Z","University of Michigan, 1980, #GoBlue University of Florida, 1982. 
Mets #LFGM, Jets, Islanders fan.","Karl",FALSE,"Florida, USA","https://pbs.twimg.com/profile_images/1363318934376693760/UMftG-DL_normal.jpg","70b7be4d968912d3",0,2,2,0,0,2297,4627,20022,0,NA
"219","@amosmagliocco Yes...cause we had the river of blood (Red Tide here in Florida).","1240508278737711104","18336824",FALSE,"79870762","en","everyone","1240656342257410054",2020-03-19 15:08:16,"SkyFormZ",FALSE,"https://t.co/OlfYUk0IYm","2008-12-23T16:54:37.000Z","Tweeting about the sky & weather since Dec. 2008. Find me everywhere on the web via @skyformz (aka Jason Foster)","SkyFormZ",FALSE,"Tampa, FL (formerly DC area) ","https://pbs.twimg.com/profile_images/579219081418694656/7ps7KS2b_normal.jpg","00ee737d2da1259c",0,0,0,0,0,2324,703,8586,188,"1334607022176804866"
"220","Science Twitter — why is California’s red tide so much nicer (re: harmless and apparently beautiful?!) compared to Florida’s red tide? 
Never saw anything like this in my years growing up in SoCal! https://t.co/X0DEsvCMrY","1257152977133023232","974010244111122432",FALSE,NA,"en","everyone","1257152977133023232",2020-05-04 03:40:01,"AdriaIrahetaTV",TRUE,"https://t.co/HTN6t11bdA","2018-03-14T19:51:53.000Z","Comms at @HillsboroughSch. Cycle instructor. Former reporter @BN9. OG @verified™️ I tweet all things Tampa & #GoBolts On a mission to change the world 🌎","Adria",FALSE,"Tampa, FL","https://pbs.twimg.com/profile_images/1612295053329702914/F-3QUCDx_normal.jpg","dc62519fda13b4ec",0,0,1,0,0,1517,1975,9960,24,NA
