"","text","created_at.x","lang","id","author_id","reply_settings","possibly_sensitive","conversation_id","in_reply_to_user_id","description","username","location","protected","url","created_at.y","name","profile_image_url","verified","pinned_tweet_id","public_metrics.x_retweet_count","public_metrics.x_reply_count","public_metrics.x_like_count","public_metrics.x_quote_count","public_metrics.x_impression_count","public_metrics.y_followers_count","public_metrics.y_following_count","public_metrics.y_tweet_count","public_metrics.y_listed_count","geo_place_id","text_with_display_links"
"300","RT @foe_us: In the middle of a public health pandemic, Trump's administration is trying to fill the Gulf with industrial aquaculture — whic…",2020-10-10 21:11:06,"en","1315037164124737538","823613018248544257","everyone",FALSE,"1315037164124737538",NA,"Peace through Culture…","JETconsul",NA,FALSE,NA,"2017-01-23T19:27:00.000Z","The Real Gnome","https://pbs.twimg.com/profile_images/1100582759452626944/vrpjb4IQ_normal.jpg",FALSE,NA,20,0,0,0,0,335,734,40055,1,NA,"In the middle of a public health pandemic, Trump's administration is trying to fill the Gulf with industrial aquaculture — which can pump antibiotics, chemicals, disease and fish waste into our oceans. 

#DontCageOurOcean

https://t.co/s13jP0NU72"
"301","RT @foe_us: In the middle of a public health pandemic, Trump's administration is trying to fill the Gulf with industrial aquaculture — whic…",2020-10-10 21:26:09,"en","1315040950134222848","870581448201424896","everyone",FALSE,"1315040950134222848",NA,"SAHM during pandemic, starved for adult convos. I have too many thoughts about Thomas the Tank Engine. Political beliefs: Capt America + Capt Planet.","GeorgeiSali"," ",FALSE,NA,"2017-06-02T10:02:46.000Z","Georgia","https://pbs.twimg.com/profile_images/1325202442938560512/g3czzIF1_normal.jpg",FALSE,"1256592422177554434",20,0,0,0,0,86,265,2032,0,NA,"In the middle of a public health pandemic, Trump's administration is trying to fill the Gulf with industrial aquaculture — which can pump antibiotics, chemicals, disease and fish waste into our oceans. 

#DontCageOurOcean

https://t.co/s13jP0NU72"
"302","RT @foe_us: In the middle of a public health pandemic, Trump's administration is trying to fill the Gulf with industrial aquaculture — whic…",2020-10-11 01:06:55,"en","1315096510028148736","297318295","everyone",FALSE,"1315096510028148736",NA,"Mum to 4, Nanny to 7, Great-Grandma to 3 !!","NannyJoan26","At my house",FALSE,NA,"2011-05-12T09:38:34.000Z","Joan Woolacott","https://pbs.twimg.com/profile_images/417420880742842368/Hzb2fMqK_normal.png",FALSE,NA,20,0,0,0,0,983,3084,66732,1,NA,"In the middle of a public health pandemic, Trump's administration is trying to fill the Gulf with industrial aquaculture — which can pump antibiotics, chemicals, disease and fish waste into our oceans. 

#DontCageOurOcean

https://t.co/s13jP0NU72"
"303","RT @foe_us: In the middle of a public health pandemic, Trump's administration is trying to fill the Gulf with industrial aquaculture — whic…",2020-10-11 11:46:19,"en","1315257416632557568","1217678519737544704","everyone",FALSE,"1315257416632557568",NA,"#NaMo My Inspiration|#Hinduism is Absolute,Not an option| On the way of #TransformingLives, That's real #achievement|& I ❤ #VENUS 🙈","Shikha_phoenix","New Delhi, India",FALSE,NA,"2020-01-16T05:24:25.000Z","Shikha_phoenix","https://pbs.twimg.com/profile_images/1531150986898616320/H-zbq9IV_normal.jpg",FALSE,"1368532390004412416",20,0,0,0,0,2246,536,21783,3,NA,"In the middle of a public health pandemic, Trump's administration is trying to fill the Gulf with industrial aquaculture — which can pump antibiotics, chemicals, disease and fish waste into our oceans. 

#DontCageOurOcean

https://t.co/s13jP0NU72"
"304","RT @foe_us: In the middle of a public health pandemic, Trump's administration is trying to fill the Gulf with industrial aquaculture — whic…",2020-10-11 13:28:57,"en","1315283248965193728","276152227","everyone",FALSE,"1315283248965193728",NA,"A disappointed optimist","hrvoji",NA,FALSE,NA,"2011-04-02T19:23:26.000Z","msema","https://pbs.twimg.com/profile_images/1553850370065137665/qFcPX_KN_normal.jpg",FALSE,"1325139109627658290",20,0,0,0,0,391,350,18589,1,NA,"In the middle of a public health pandemic, Trump's administration is trying to fill the Gulf with industrial aquaculture — which can pump antibiotics, chemicals, disease and fish waste into our oceans. 

#DontCageOurOcean

https://t.co/s13jP0NU72"
"305","News just in! CFS and allies have filed an appeal against the #EPA pollution discharge permit for #VelellaEpsilon, an industrial #finfish #aquaculture facility vying for construction permits in federal waters off of Sarasota, #Florida. @foe_us . https   www centerforfoodsafety org press releases 6183 coalition appeals epa permit allowing industrial wastewater from fish farm in gulf of mexico",2020-11-02 21:51:21,"en","1323382214080389121","18694861","everyone",FALSE,"1323382214080389121",NA,"Protecting our food, farms & environment! #NoFactoryFarms #ProtectPollinators Get the latest: https://t.co/cm4w750SDD","CFSTrueFood","DC | CA | OR | HI",FALSE,"https://t.co/jR0QO89re3","2009-01-06T20:56:35.000Z","Center for Food Safety","https://pbs.twimg.com/profile_images/439099925029060608/2JlBm5lf_normal.png",FALSE,"1590483601225023488",0,0,3,0,0,46343,9123,16536,1255,NA,"News just in! CFS and allies have filed an appeal against the #EPA pollution discharge permit for #VelellaEpsilon, an industrial #finfish #aquaculture facility vying for construction permits in federal waters off of Sarasota, #Florida. @foe_us https://t.co/v4Exmb8Ubz"
"306","SARASOTA, Fla. – After a leak in the liner of a reservoir caused a partial breach in one of its containment walls, officials hope pumping 30 M gallons of wastewater into the Tampa Bay ecosystem will relieve pressure on the walls &amp; reduce chance of an uncontrolled major breach. . https   twitter com drummike2012 status 1379118259291688967",2021-04-05 18:13:26,"en","1379135105751375875","111101761","everyone",FALSE,"1379135105751375875",NA,"My F-bombs drop F-bombs. When I comb my hair nice-my horns don't show. Nov 13 ♏️ he/him 🚫DM’s ! 🇨🇦🇺🇸🏳️‍🌈 #LGBTQIA+ #BLM #BlueCrew","snapshutter","North of Seattle ",FALSE,NA,"2010-02-03T20:35:05.000Z","Rotten Robbie","https://pbs.twimg.com/profile_images/1481480644760801280/pzztGkKw_normal.jpg",FALSE,"1305194450025500672",0,1,0,0,0,33357,35093,61692,13,NA,"SARASOTA, Fla. – After a leak in the liner of a reservoir caused a partial breach in one of its containment walls, officials hope pumping 30 M gallons of wastewater into the Tampa Bay ecosystem will relieve pressure on the walls &amp; reduce chance of an uncontrolled major breach. https://t.co/9C33jS5BX7"
"307","@snapshutter Oh, no. 🤬",2021-04-05 18:22:11,"en","1379137307496869888","824684964105113600","everyone",FALSE,"1379135105751375875","111101761","Make 2023 the year of ACCOUNTABILITY!! #FightFascism #BlackLivesMatter #MMIWG2S #LoveIsLove 🇺🇦🏳️‍🌈","mrsmushnik","Earth  🌎",FALSE,NA,"2017-01-26T18:26:32.000Z","Steph 🐝 ☮️💙","https://pbs.twimg.com/profile_images/1563335181775151105/cT9HI6fg_normal.jpg",FALSE,NA,0,0,1,0,0,2386,2706,16227,2,NA,NA
"308","@JohnMoralesNBC6 @craigtimes @TB_Times I am asuming we will see this wastewater affecting Tampa Bay, St. Pete Beach. Clearwater, Anna Maria Island, Long Boat Key, Siesta Key and Sarasota Bay.. ",2021-04-06 02:23:55,"en","1379258538422374401","26076407","everyone",FALSE,"1379238597182767115","55419844","Moderate. Country First. Democracy. No party affiliation. Engineer. UF alumni. Statehood supporter for Puerto Rico & the U.S. Virgin Islands. Surfing is Life.","SJUA08","USA",FALSE,NA,"2009-03-23T19:59:21.000Z","Kiki","https://pbs.twimg.com/profile_images/1563861024297582592/niRlJA_O_normal.jpg",FALSE,"1586910860966072323",0,0,3,1,0,1700,2265,61496,27,NA,"@JohnMoralesNBC6 @craigtimes @TB_Times I am asuming we will see this wastewater affecting Tampa Bay, St. Pete Beach. Clearwater, Anna Maria Island, Long Boat Key, Siesta Key and Sarasota Bay."
"309","As eyes across the nation follow the environmental crisis at Piney Point, ecological groups like Sarasota Dolphin Research Program have raised alarms on the impact the pumping of wastewater will have on Tampa Bay and its natural inhabitants. . http   srqmagazine com srq daily 2021 04 12 16759_Sarasota Dolphin Research Program Monitoring Piney Point Effects",2021-04-12 14:21:43,"en","1381613505732808714","207800829","everyone",FALSE,"1381613505732808714",NA,"Engaging residents, visitors, arts enthusiasts & luxury connoisseurs in the active, vibrant living of the Creative Coast. #LiveLocal #LoveLocal","srq_mag","Sarasota, Florida",FALSE,"https://t.co/QhsL5lUOML","2010-10-26T01:55:10.000Z","SRQ Magazine","https://pbs.twimg.com/profile_images/1436338512522006535/8pjqddut_normal.jpg",FALSE,NA,1,1,1,0,0,8794,247,2326,91,NA,"As eyes across the nation follow the environmental crisis at Piney Point, ecological groups like Sarasota Dolphin Research Program have raised alarms on the impact the pumping of wastewater will have on Tampa Bay and its natural inhabitants. https://t.co/4fEJ7C2okT"
"310","@SRQChirps If you trust the authorities on this one you will regret it. #stayvigilant",2021-04-12 14:28:52,"en","1381615303927422980","471534389","everyone",FALSE,"1381613505732808714","207800829","Paying the mortgage; swimming when I can. Big queen.","GaySpaceLaser","NORTH TRURO, MA",FALSE,NA,"2012-01-23T00:16:09.000Z","G S Laser","https://pbs.twimg.com/profile_images/2571529164/zm5xz81sqa41ozfb3u4k_normal.jpeg",FALSE,NA,0,0,0,0,0,29,154,616,1,NA,NA
"311","RT @SRQChirps: As eyes across the nation follow the environmental crisis at Piney Point, ecological groups like Sarasota Dolphin Research P…",2021-04-12 17:10:52,"en","1381656074755973124","32651107","everyone",FALSE,"1381656074755973124",NA,"","Sugamommaof7",NA,FALSE,NA,"2009-04-17T23:15:13.000Z","Mscp69","https://pbs.twimg.com/profile_images/1517182421791346694/MT7UE8hz_normal.jpg",FALSE,NA,1,0,0,0,0,1839,1335,170121,5,NA,"As eyes across the nation follow the environmental crisis at Piney Point, ecological groups like Sarasota Dolphin Research Program have raised alarms on the impact the pumping of wastewater will have on Tampa Bay and its natural inhabitants. https://t.co/4fEJ7C2okT"
"312","Advanced Film Solutions makes homes and offices cool and UV free. #LLumar by Eastman Chemicals Tampa's answer for the heat.  . http   www advancedfilmfl net vista window film solar security home office window tinting tampa bay sarasota orlando competitive edge. https   twitter com ex3m status 1383003621059661825 photo 1",2021-04-16 10:25:32,"en","1383003621059661825","11434152","everyone",FALSE,"1383003621059661825",NA,"Mike Feldman, Advanced Film Solutions. Taking window film where's it never gone before. Think it's boring? Think again!","ex3m","Tampa, FL",FALSE,"http://t.co/7UzOOSuIaX","2007-12-22T15:50:16.000Z","ex3m","https://pbs.twimg.com/profile_images/2752259063/59bfa965a0102c964d779f73c3392bb8_normal.png",FALSE,NA,0,0,0,0,0,4316,1477,22358,28,NA,"Advanced Film Solutions makes homes and offices cool and UV free. #LLumar by Eastman Chemicals Tampa's answer for the heat. https://t.co/BauU5OoifQ https://t.co/ACWyeQVFJP"
"313","@GovRonDeSantis @FLDEPNews  

Who says it's ok to dump wastewater into our ocean and destroy the gulf yet again?. https   www wfla com news sarasota county red tide reported at several sarasota county beaches health officials warn",2021-04-16 14:38:00,"en","1383067153792913411","709875526899474432","everyone",FALSE,"1382042387804000261","1058807868","","BizarroJerry16",NA,FALSE,NA,"2016-03-15T22:54:49.000Z","Bizarro-Jerry","https://pbs.twimg.com/profile_images/1060322541686980608/Get4j0id_normal.jpg",FALSE,NA,0,0,0,0,0,4,62,1723,0,NA,"@GovRonDeSantis @FLDEPNews https://t.co/Lmh9P9c61e 

Who says it's ok to dump wastewater into our ocean and destroy the gulf yet again?"
"314","Learn about the preserves that are most affected by #pineypoint wastewater discharges into Tampa Bay 
 via @heraldtribune. https   www heraldtribune com story news environment 2021 04 19 sensitive habitat under pressure piney point wastewater tampa bay manatee sarasota 7250692002",2021-04-19 14:04:38,"en","1384145919810052111","1262593178827358208","everyone",FALSE,"1384145919810052111",NA,"","NSGJesse",NA,FALSE,NA,"2020-05-19T03:57:34.000Z","NSGJesse","https://pbs.twimg.com/profile_images/1262593419307819009/z8Z_5Uzx_normal.jpg",FALSE,NA,0,0,1,0,0,1,34,52,0,NA,"Learn about the preserves that are most affected by #pineypoint wastewater discharges into Tampa Bay 
https://t.co/XJ7waEsKuL via @heraldtribune"
"315","Learn about the preserves and ecosystems most affected by #pineypoint wastewater released into Tampa Bay
  via @heraldtribune. https   www heraldtribune com story news environment 2021 04 19 sensitive habitat under pressure piney point wastewater tampa bay manatee sarasota 7250692002",2021-04-19 14:09:12,"en","1384147070949355524","855611885164654593","everyone",FALSE,"1384147070949355524",NA,"I cover Manatee County news for the Sarasota Herald-Tribune, and anything else in Florida they let me write about!","Reportographer","Bradenton, FL",FALSE,NA,"2017-04-22T02:39:04.000Z","Jesse Mendoza","https://pbs.twimg.com/profile_images/1412557251903164416/nvf-NJ7I_normal.jpg",FALSE,NA,1,0,1,1,0,256,243,242,8,NA,"Learn about the preserves and ecosystems most affected by #pineypoint wastewater released into Tampa Bay
 https://t.co/nrx4E8qNdL via @heraldtribune"
"316","Scientists tracking environmental impacts from Piney Point wastewater release . https   www heraldtribune com story news environment 2021 04 19 sensitive habitat under pressure piney point wastewater tampa bay manatee sarasota 7250692002",2021-04-19 15:36:07,"en","1384168943615545346","705132143744188416","everyone",FALSE,"1384168943615545346",NA,"Harnessing the power of the private sector in wetland, water and species mitigation and conservation #NMEMC","NMEMConference",NA,FALSE,"https://t.co/9aO0qHblk6","2016-03-02T20:46:18.000Z","NMEMConference","https://pbs.twimg.com/profile_images/1562137766208708614/WOfr1_dt_normal.png",FALSE,NA,0,0,0,1,0,363,767,5435,7,NA,"Scientists tracking environmental impacts from Piney Point wastewater release https://t.co/IzEZL2I1da"
"317","Red Tide noticed in Sarasota last week, but it's still unclear whether Piney Point wastewater discharge from the north in Tampa Bay will meet with Red Tide organisms and fuel a bloom. . https   twitter com amy_hollyfield status 1383039520682217477",2021-04-19 20:52:33,"en","1384248575123542017","213164823","everyone",FALSE,"1384248575123542017",NA,"Investigative reporter @TB_Times. zsampson@tampabay.com. On Signal: 813-534-0157. he/him.","ZackSampson","St. Petersburg, Fla.",FALSE,"https://t.co/YleaqdcAN8","2010-11-08T04:18:07.000Z","Zack Sampson","https://pbs.twimg.com/profile_images/560772860545757185/UJ0f-WFA_normal.jpeg",TRUE,NA,4,0,2,1,0,3325,865,14755,153,NA,"Red Tide noticed in Sarasota last week, but it's still unclear whether Piney Point wastewater discharge from the north in Tampa Bay will meet with Red Tide organisms and fuel a bloom. https://t.co/jZn2CL1Vn6"
"318","RT @ZackSampson: Red Tide noticed in Sarasota last week, but it's still unclear whether Piney Point wastewater discharge from the north in…",2021-04-19 21:13:32,"en","1384253856037494793","388403805","everyone",FALSE,"1384253856037494793",NA,"Data editor for @TB_Times. | He/Him.","langstonitaylor","~~Pay your interns.~~",FALSE,"https://t.co/R6j9Wu9kRR","2011-10-10T17:55:05.000Z","Langston Taylor","https://pbs.twimg.com/profile_images/1549607894471024643/qPNmpKmZ_normal.jpg",TRUE,NA,4,0,0,0,0,3770,2438,39953,110,NA,"Red Tide noticed in Sarasota last week, but it's still unclear whether Piney Point wastewater discharge from the north in Tampa Bay will meet with Red Tide organisms and fuel a bloom. https://t.co/jZn2CL1Vn6"
"319","The full effects of the Piney Point wastewater discharge is not yet known, but we're already seeing a multiyear, multidisciplinary effort by scientists to fully understand the impact of so much nitrogen will have on ecosystems. via .@Reportographer 

. https   www heraldtribune com story news environment 2021 04 19 sensitive habitat under pressure piney point wastewater tampa bay manatee sarasota 7250692002",2021-04-19 21:35:18,"en","1384259334784184328","818905460766023681","everyone",FALSE,"1384259334784184328",NA,"Reporter, solver of weird mysteries, archival storyteller, bad pun writer for @ExpressNews. Recovering Florida man. Prior @TB_Times @HeraldTribune newshound.","TimothyJFanning","St. Petersburg ➡️ San Antonio ",FALSE,NA,"2017-01-10T19:40:51.000Z","Timothy Fanning","https://pbs.twimg.com/profile_images/1499587860764184588/sCRV9sat_normal.jpg",TRUE,"1584618746127085569",1,0,1,1,0,1157,832,5089,26,NA,"The full effects of the Piney Point wastewater discharge is not yet known, but we're already seeing a multiyear, multidisciplinary effort by scientists to fully understand the impact of so much nitrogen will have on ecosystems. via .@Reportographer 

https://t.co/urSgT76Czt"
"320","RT @Reportographer: Learn about the preserves and ecosystems most affected by #pineypoint wastewater released into Tampa Bay
 https://t.co/…",2021-04-19 22:49:36,"en","1384278032710443008","617581678","everyone",FALSE,"1384278032710443008",NA,"assistant director for @TBEP1991 https://t.co/vZegZF5OjC #envsocsci #marsocsci #scipol #openscience #floridawoman","mayaburke","saint petersburg, florida",FALSE,NA,"2012-06-24T23:39:56.000Z","maya","https://pbs.twimg.com/profile_images/1516912986044219393/3EY2-XpH_normal.jpg",FALSE,NA,1,0,0,0,0,205,732,469,2,NA,"Learn about the preserves and ecosystems most affected by #pineypoint wastewater released into Tampa Bay
 https://t.co/nrx4E8qNdL via @heraldtribune"
"321","RT @ZackSampson: Red Tide noticed in Sarasota last week, but it's still unclear whether Piney Point wastewater discharge from the north in…",2021-04-19 22:51:58,"en","1384278629387890699","617581678","everyone",FALSE,"1384278629387890699",NA,"assistant director for @TBEP1991 https://t.co/vZegZF5OjC #envsocsci #marsocsci #scipol #openscience #floridawoman","mayaburke","saint petersburg, florida",FALSE,NA,"2012-06-24T23:39:56.000Z","maya","https://pbs.twimg.com/profile_images/1516912986044219393/3EY2-XpH_normal.jpg",FALSE,NA,4,0,0,0,0,205,732,469,2,NA,"Red Tide noticed in Sarasota last week, but it's still unclear whether Piney Point wastewater discharge from the north in Tampa Bay will meet with Red Tide organisms and fuel a bloom. https://t.co/jZn2CL1Vn6"
"322","RT @ZackSampson: Red Tide noticed in Sarasota last week, but it's still unclear whether Piney Point wastewater discharge from the north in…",2021-04-19 23:02:49,"en","1384281359984648197","41655179","everyone",FALSE,"1384281359984648197",NA,"We seek to protect our outstanding animals and plants and the lands and waters they need to survive. We have raised and donated more than $60 million.","wildlife_fl","Florida",FALSE,"https://t.co/rzZuCK2zRg","2009-05-21T19:18:20.000Z","Fish & Wildlife FL","https://pbs.twimg.com/profile_images/1367237700210872320/MK6mAQnl_normal.jpg",FALSE,NA,4,0,0,0,0,6094,904,10268,140,NA,"Red Tide noticed in Sarasota last week, but it's still unclear whether Piney Point wastewater discharge from the north in Tampa Bay will meet with Red Tide organisms and fuel a bloom. https://t.co/jZn2CL1Vn6"
"323","RT @ZackSampson: Red Tide noticed in Sarasota last week, but it's still unclear whether Piney Point wastewater discharge from the north in…",2021-04-19 23:03:54,"en","1384281632652218378","6094462","everyone",FALSE,"1384281632652218378",NA,"he/him Lightning, Bjorkloven (Det är skönt att älska Björklöven) @Evilworms@mastodon.social","evilworms","Englewood, Florida",FALSE,"https://t.co/FDMZWvIKG8","2007-05-17T01:50:26.000Z","Kemo ⚡💚💛","https://pbs.twimg.com/profile_images/1524804000637394945/G71MTvR-_normal.jpg",FALSE,"1376004127239647234",4,0,0,0,0,394,1415,24878,0,NA,"Red Tide noticed in Sarasota last week, but it's still unclear whether Piney Point wastewater discharge from the north in Tampa Bay will meet with Red Tide organisms and fuel a bloom. https://t.co/jZn2CL1Vn6"
"324","Scientists tracking environmental impacts from Piney Point wastewater release  via @heraldtribune. https   www heraldtribune com story news environment 2021 04 19 sensitive habitat under pressure piney point wastewater tampa bay manatee sarasota 7250692002",2021-04-19 23:09:54,"en","1384283143918686209","534263140","everyone",FALSE,"1384283143918686209",NA,"","FloridaIssues",NA,FALSE,NA,"2012-03-23T12:49:26.000Z","Florida Issues","https://pbs.twimg.com/profile_images/1169906487172333577/HqrgWFkr_normal.jpg",FALSE,NA,1,0,1,0,0,1024,10,135110,40,NA,"Scientists tracking environmental impacts from Piney Point wastewater release https://t.co/lNafyOzDmd via @heraldtribune"
"325","RT @FloridaIssues: Scientists tracking environmental impacts from Piney Point wastewater release https://t.co/lNafyOzDmd via @heraldtribune",2021-04-19 23:17:43,"en","1384285107364585476","719284318716182529","everyone",FALSE,"1384285107364585476",NA,"University High School's environmental science classes with Mr. Haught. A combo of environmental education & Titan pride.","uhsenviro","Orange City, FL",FALSE,NA,"2016-04-10T22:02:00.000Z","UHS Environmental","https://pbs.twimg.com/profile_images/1277706103158116356/yI1VXZYY_normal.jpg",FALSE,NA,1,0,0,0,0,407,280,9994,2,NA,"Scientists tracking environmental impacts from Piney Point wastewater release https://t.co/lNafyOzDmd via @heraldtribune"
"326","“Every time the tide sloshes to the north or to the south, this plume is going to spread a little bit more to the north and to the south,” Robert Weisberg, a #USF physical #oceanography expert said. #PineyPoint #PineyPointUpdate @usfsp 

. https   www heraldtribune com story news environment 2021 04 19 sensitive habitat under pressure piney point wastewater tampa bay manatee sarasota 7250692002",2021-04-20 19:54:53,"en","1384596451729154052","778876070","everyone",FALSE,"1384596451729154052",NA,"The College of Marine Science at USF (USF CMS) is a top 10 marine science program. Founded in 1967, the CMS holds broad expertise in all things ocean. #usfcms","USFCMS","St. Petersburg, FL",FALSE,"https://t.co/OPCoji0JUA","2012-08-24T20:03:27.000Z","USF Marine Science","https://pbs.twimg.com/profile_images/1125455746223759360/_hNYdcoQ_normal.jpg",FALSE,NA,0,0,2,2,0,2609,1178,5064,54,NA,"“Every time the tide sloshes to the north or to the south, this plume is going to spread a little bit more to the north and to the south,” Robert Weisberg, a #USF physical #oceanography expert said. #PineyPoint #PineyPointUpdate @usfsp 

https://t.co/fyhRwJv7q5"
"327","Scientists tracking environmental impacts from Piney Point wastewater release  via @HeraldTribune. https   www heraldtribune com story news environment 2021 04 19 sensitive habitat under pressure piney point wastewater tampa bay manatee sarasota 7250692002",2021-04-20 21:02:57,"en","1384613581770039301","3103707085","everyone",FALSE,"1384613581770039301",NA,"Loud HS baseball mom. I'm probably at a ballpark. ❤ sports/ music. At 8yrs old, my son created this Twitter acct to follow Colin Kap. I'm doin somethin right!","quixlady",NA,FALSE,NA,"2015-03-22T19:43:42.000Z","⚾️ SpecialSauce ⚾️","https://pbs.twimg.com/profile_images/1514828707814207489/MkIbQTQ7_normal.jpg",FALSE,"1222020187110510592",0,0,1,1,0,372,1626,70409,3,NA,"Scientists tracking environmental impacts from Piney Point wastewater release https://t.co/F4jUZ0MGHe via @HeraldTribune"
"328","Scientists tracking impacts from Piney Point wastewater release from cockroach bay to clearwater beach  via @HeraldTribune. https   www heraldtribune com story news environment 2021 04 19 sensitive habitat under pressure piney point wastewater tampa bay manatee sarasota 7250692002",2021-04-20 23:10:16,"en","1384645623153037312","16801780","everyone",FALSE,"1384645623153037312",NA,"Latin....Work, but remember if your not conformist, hyperobedient,  risk averse or good at echoing opinions of authorities, you can't be an elite, thank god","mveal2006","florida",FALSE,NA,"2008-10-16T03:40:35.000Z","Face aut tace (act or be silent)","https://pbs.twimg.com/profile_images/1376729971012554752/4j_BHD2M_normal.jpg",FALSE,"1367964217064763394",0,0,0,0,0,118,250,35585,7,NA,"Scientists tracking impacts from Piney Point wastewater release from cockroach bay to clearwater beach https://t.co/sUp2PlghU4 via @HeraldTribune"
"329","Scientists tracking environmental impacts from Piney Point wastewater release.   Just because the immediate disaster at Piney Point has passed doesn’t mean we can become complacent.  Clean this mess up now, Florida!!! . https   www heraldtribune com story news environment 2021 04 19 sensitive habitat under pressure piney point wastewater tampa bay manatee sarasota 7250692002",2021-04-20 23:13:25,"en","1384646415876505601","1689406291","everyone",FALSE,"1384646415876505601",NA,"Mod Dem. Penn State! Frmr teacher/cable talk show host. ♥Dogs. Lvd in-PA VA CT MA Prague + FL. Ban AR-15’s. Trumpy sucks.","caroltalkin",NA,FALSE,NA,"2013-08-21T22:27:09.000Z","Carol Kay","https://pbs.twimg.com/profile_images/747941370086699010/ZLRunk5a_normal.jpg",FALSE,NA,2,0,2,0,0,1239,1230,4359,0,NA,"Scientists tracking environmental impacts from Piney Point wastewater release.   Just because the immediate disaster at Piney Point has passed doesn’t mean we can become complacent.  Clean this mess up now, Florida!!! https://t.co/VHnNXmiFHa"
