"","text","id","reply_settings","possibly_sensitive","conversation_id","author_id","created_at.x","lang","in_reply_to_user_id","profile_image_url","location","created_at.y","verified","protected","url","description","username","name","pinned_tweet_id","public_metrics.x_retweet_count","public_metrics.x_reply_count","public_metrics.x_like_count","public_metrics.x_quote_count","public_metrics.x_impression_count","geo_place_id","public_metrics.y_followers_count","public_metrics.y_following_count","public_metrics.y_tweet_count","public_metrics.y_listed_count","text_with_display_links"
"1","It was not there in 1990 when I first arrived. Part of it was also landlords dumping raw sewage directly into the bay, and the same thing happened over on Bayshore Boulevard in Tampa.. ","949161767522902016","everyone",FALSE,"949161767522902016","179165637",2018-01-05 06:12:54,"en",NA,"https://pbs.twimg.com/profile_images/850817161840939008/xpBkEHmL_normal.jpg","Riverside, CA","2010-08-16T17:28:06.000Z",FALSE,FALSE,"https://t.co/oaRRYOQYfx","Working on some low emissions power, propulsion, and transportation projects right now...","jamescarrow","James Carrow",NA,0,0,0,0,0,NA,83,181,91844,0,"It was not there in 1990 when I first arrived. Part of it was also landlords dumping raw sewage directly into the bay, and the same thing happened over on Bayshore Boulevard in Tampa."
"2","@Kansei13Kansei We do that daily in the U.S. too. =\ I live in Tampa Bay, and we've been dealing with a huge release of raw sewage.    Nicaragua however has almost 90% of its energy coming from renewable resources already. We definitely don't, but should.. http   wusfnews wusf usf edu post st pete upgrades should keep sewage out tampa bay","951186448182587392","everyone",FALSE,"950679284464668673","485490353",2018-01-10 20:18:16,"en","713377689743335424","https://pbs.twimg.com/profile_images/1083150828096110592/oRJOOdYa_normal.jpg","Resisting in Tampa Bay!","2012-02-07T07:59:53.000Z",FALSE,FALSE,"https://t.co/5X2rm6kDXB","Resisting🌟More American Than 🍎 🥧Insatiably Curious📘1st Nation🪶GA🍑SC🌴France🍷KY🏇LA⚜️OH🛩️FL🏖️ Πολλά Idiomas Spoken Ici🦋♤ ❤️ = I see you","SixieGames","Six","1543622518522658818",0,1,1,0,0,NA,3595,3414,130583,9,"@Kansei13Kansei We do that daily in the U.S. too. =\ I live in Tampa Bay, and we've been dealing with a huge release of raw sewage.  https://t.co/pTZGfJuJbV  Nicaragua however has almost 90% of its energy coming from renewable resources already. We definitely don't, but should."
"3","So what exactly defines one as a shithole country....""million gallons of partially treated sewage had been dumped into the waters of Tampa Bay"" - St. Petersburg’s latest sewage mystery is quite colorful . https   www tampabay com news environment St Petersburg s latest sewage mystery is quite colorful_166130332","973941527549566976","everyone",FALSE,"973941527549566976","3438519137",2018-03-14 15:18:49,"en",NA,"https://pbs.twimg.com/profile_images/1352420717237776390/wVuGmXiH_normal.jpg","crazytown","2015-08-24T22:08:33.000Z",FALSE,FALSE,"https://t.co/sxy3Ykozk3","WE THE THUNDER ⚡️ a TB Lightning Podcast Host & Producer 🧮 Occasional animator and content creator 🪧
instagram: @shooteyshoots","shooteyshoots","the return of Shooter","1583135896853176321",0,0,0,0,0,NA,1023,978,25777,33,"So what exactly defines one as a shithole country....""million gallons of partially treated sewage had been dumped into the waters of Tampa Bay"" - St. Petersburg’s latest sewage mystery is quite colorful https://t.co/MwsbpIflMZ"
"4","Mayor Rick Kriseman: Stop St. Pete's illegal dumping of raw and partially treated sewage into Tampa B...  via @Change. https   www change org p mayor rick kriseman stop st pete s illegal dumping of raw and partially treated sewage into tampa bay s water","979218522344755200","everyone",FALSE,"979218522344755200","302814665",2018-03-29 04:47:43,"en",NA,"https://pbs.twimg.com/profile_images/806315956049821696/TQwTICR6_normal.jpg",NA,"2011-05-21T20:10:45.000Z",FALSE,FALSE,NA,"I am a spiritual being having a human experience.","revcarlag","Carla","1509208754549624835",0,0,0,0,0,NA,162,284,13042,0,"Mayor Rick Kriseman: Stop St. Pete's illegal dumping of raw and partially treated sewage into Tampa B... https://t.co/rlXjI7qQEp via @Change"
"5","@SenBillNelson Please make sure sewage dumping ends in Tampa Bay. ","979541105640443904","everyone",FALSE,"979461947098783744","591447395",2018-03-30 02:09:33,"en","20597460","https://pbs.twimg.com/profile_images/1465408560737796102/XWyBkBfD_normal.jpg",NA,"2012-05-27T02:46:03.000Z",FALSE,FALSE,NA,"🎨📚 💚 National Parks🍀 I retweet different points of view.","artist57101","Charlotte","1354467237902639112",0,0,0,0,0,NA,122,254,22142,10,"@SenBillNelson Please make sure sewage dumping ends in Tampa Bay"
"6","@itsmeMissEm @davidhogg111 @FLGovScott @FLStateParks Lol. The lagoon 🙄 The lagoon near me is beautiful. But ya, blame Republicans 4 sum dead fish... However, we CAN thank our democrat mayor 4 dumping raw sewage into Tampa Bay recently. Certainly wasnt Scotts fault. Altho Im sure youll find some roundabout way of doing just that. ","988408801027067904","everyone",FALSE,"988058734915145728","937382621226717184",2018-04-23 13:26:36,"en","3288561705","https://pbs.twimg.com/profile_images/1608497896592138245/EDVBnBd5_normal.jpg","United States","2017-12-03T18:06:47.000Z",FALSE,FALSE,"https://t.co/zJZ2yg6Hym","When it suits their purpose liberals wrap themselves in the Constitution, but in their books & classrooms they call the Founding Fathers “racist-classist pigs”","JakeCutter99","Jake Cutter - blocked by John Cusak","1443025568958668804",0,0,0,0,0,NA,218,1377,8996,0,"@itsmeMissEm @davidhogg111 @FLGovScott @FLStateParks Lol. The lagoon 🙄 The lagoon near me is beautiful. But ya, blame Republicans 4 sum dead fish... However, we CAN thank our democrat mayor 4 dumping raw sewage into Tampa Bay recently. Certainly wasnt Scotts fault. Altho Im sure youll find some roundabout way of doing just that"
"7","Tampa Bay has more sewage than you think
If the mainstream media has you believing only St. Petersburg has sewage spills, you've got to read this.

CATHY SALUSTRI  MAY 30,... . https   www cltampa com news views environment article 21006580 tampa bay has more sewage than you think","1001795969510494208","everyone",FALSE,"1001795969510494208","534263140",2018-05-30 12:02:26,"en",NA,"https://pbs.twimg.com/profile_images/1169906487172333577/HqrgWFkr_normal.jpg",NA,"2012-03-23T12:49:26.000Z",FALSE,FALSE,NA,"","FloridaIssues","Florida Issues",NA,0,0,1,0,0,NA,1024,10,135110,40,"Tampa Bay has more sewage than you think
If the mainstream media has you believing only St. Petersburg has sewage spills, you've got to read this.

CATHY SALUSTRI  MAY 30,... https://t.co/ewvX17XTOK"
"8","Some other Tampa Bay cities have let more sewage flow than St. Petersburg.  . https   www cltampa com news views environment article 21006580 st petersburg isnt the only city with sewage spills","1001876050979229697","everyone",FALSE,"1001876050979229697","14193993",2018-05-30 17:20:39,"en",NA,"https://pbs.twimg.com/profile_images/1542872284259651587/a85ifeZZ_normal.jpg","Tampa Bay, FL","2008-03-21T22:23:23.000Z",TRUE,FALSE,"https://t.co/yfgOGOMEdW","Tampa Bay's alternative newsweekly. Local news, reviews, music, movies, food, drinks, sex, local events & more.","cl_tampabay","Creative Loafing: Tampa Bay",NA,0,0,0,0,0,NA,69748,2816,51389,777,"Some other Tampa Bay cities have let more sewage flow than St. Petersburg.  https://t.co/l9Aiv8ERI8"
"9","Where will sewage spill next in the Tampa Bay area? Just follow @CharlieFrago. . http   www tampabay com blogs baybuzz 2018 06 04 tampa sewage spill shuts down water activities in davis island channel","1003663665529262080","everyone",FALSE,"1003663665529262080","119945205",2018-06-04 15:43:59,"en",NA,"https://pbs.twimg.com/profile_images/1107681713327505408/c3Bt1MN7_normal.png","Cleveland, OH","2010-03-05T01:07:56.000Z",TRUE,FALSE,"https://t.co/oEoq0MEPcp","Investigative reporter at @marshallproj Once: @TB_Times, @LATimes, @baltimoresun, @theplaindealer, trucker & Teamster. Email: mpuente@themarshallproject.org","MarkPuente","Mark Puente","1536651712118784000",3,0,0,0,0,NA,5403,3261,21985,249,"Where will sewage spill next in the Tampa Bay area? Just follow @CharlieFrago. https://t.co/SiG84HoAhy"
"10","RT @MarkPuente: Where will sewage spill next in the Tampa Bay area? Just follow @CharlieFrago. https://t.co/SiG84HoAhy","1003665409453813762","everyone",FALSE,"1003665409453813762","33069210",2018-06-04 15:50:55,"en",NA,"https://pbs.twimg.com/profile_images/1610520480380846082/40uZveCe_normal.jpg","fascist Floriduh","2009-04-19T00:39:54.000Z",FALSE,FALSE,NA,"like: kitties, soup, Rays ⚾ & Lightning 🏒 

#MaskedForever #IronKitty","MandaGator","@MandaGator (she/her)","1055939044771799041",3,0,0,0,0,NA,1520,1580,211007,62,"Where will sewage spill next in the Tampa Bay area? Just follow @CharlieFrago. https://t.co/SiG84HoAhy"
"11","RT @MarkPuente: Where will sewage spill next in the Tampa Bay area? Just follow @CharlieFrago. https://t.co/SiG84HoAhy","1003673159311257601","everyone",FALSE,"1003673159311257601","2933793124",2018-06-04 16:21:43,"en",NA,"https://pbs.twimg.com/profile_images/1593015897379246083/TT5JtdLV_normal.jpg","Just out of Sorts","2014-12-20T15:28:21.000Z",FALSE,FALSE,NA,"Lost wife & best friend, Emily, 11/19/2017.
Blue. Gunsense. BLM. BDS.
Repulsed by hatred, bigotry & the Republican war against democracy itself!
Vote Blue!","kenkircher1","End the Filibuster!☮️ 💔🌈🛶🚭🌊🇺🇦","1043546526029676544",3,0,0,0,0,NA,2682,1302,1199579,28,"Where will sewage spill next in the Tampa Bay area? Just follow @CharlieFrago. https://t.co/SiG84HoAhy"
"12","RT @MarkPuente: Where will sewage spill next in the Tampa Bay area? Just follow @CharlieFrago. https://t.co/SiG84HoAhy","1004173975369539584","everyone",FALSE,"1004173975369539584","66372964",2018-06-06 01:31:47,"en",NA,"https://pbs.twimg.com/profile_images/1453333651702288384/ObwaasOa_normal.jpg","Tampa Bay, Florida","2009-08-17T15:00:02.000Z",FALSE,FALSE,"https://t.co/WnlhCW3pN1","Author of Publicity on Steroids | Director of Publicity and Marketing for Alive Book Publishing | President of The Reps","DrFredaDrake","Frēda Drake",NA,3,0,0,0,0,NA,484,751,1213,0,"Where will sewage spill next in the Tampa Bay area? Just follow @CharlieFrago. https://t.co/SiG84HoAhy"
"13","@craigtimes @MoteMarineLab My laymen’s casual observation is that the strongest outbreaks along SWFL tend to correlate with the health of Tampa Bay. We had several relatively calm years as the Bay really recovered, until the major sewage dump in St. Pete.. ","1015246586174156801","everyone",FALSE,"1015232561067581440","125802576",2018-07-06 14:50:23,"en","62575859","https://pbs.twimg.com/profile_images/860280695566073856/Uc1SYJ1q_normal.jpg","Florida, USA","2010-03-23T22:47:10.000Z",TRUE,FALSE,"https://t.co/DjAvULXdOb","Christian. Husband. Father. Floridian. Passionate defender of limited government and individual liberties. #2lanetravels","mattcaldwell_fl","Matt Caldwell",NA,0,1,0,0,0,NA,6121,0,9110,128,"@craigtimes @MoteMarineLab My laymen’s casual observation is that the strongest outbreaks along SWFL tend to correlate with the health of Tampa Bay. We had several relatively calm years as the Bay really recovered, until the major sewage dump in St. Pete."
"14","@mattcaldwell_fl @MoteMarineLab @MyFWC Not arguing. Just pointing out that the bay itself is not suffering from any such blooms. The Red Tide bloom going on now in SW #Florida started in November, well after the summer sewage dumping in Tampa Bay occurred. Suggests to me that other explanations may make more sense.. ","1015250124023443457","everyone",FALSE,"1015232561067581440","62575859",2018-07-06 15:04:26,"en","125802576","https://pbs.twimg.com/profile_images/1438867672494657541/cMKAyT15_normal.jpg","St. Petersburg FL","2009-08-03T17:55:56.000Z",FALSE,FALSE,"https://t.co/Y1kqEYKFCg","THE STATE YOU'RE IN & MANATEE INSANITY both out in paperback now! Other books: NYT bestseller OH, FLORIDA! & CAT TALE. Columnist, Florida Phoenix. Florida man.","craigtimes","Craig Pittman","1437092398249689093",1,0,1,0,0,NA,20463,2281,179431,859,"@mattcaldwell_fl @MoteMarineLab @MyFWC Not arguing. Just pointing out that the bay itself is not suffering from any such blooms. The Red Tide bloom going on now in SW #Florida started in November, well after the summer sewage dumping in Tampa Bay occurred. Suggests to me that other explanations may make more sense."
"15","RT @craigtimes: @mattcaldwell_fl @MoteMarineLab @MyFWC Not arguing. Just pointing out that the bay itself is not suffering from any such bl…","1015580263081005056","everyone",FALSE,"1015580263081005056","2857581195",2018-07-07 12:56:17,"en",NA,"https://pbs.twimg.com/profile_images/1600645564416380928/taQmOmde_normal.jpg","Jensen Beach, Florida","2014-11-02T20:48:57.000Z",FALSE,FALSE,NA,"historian, high school sailing coach, author 'indian river lagoon: an environmental history' (@floridapress) catboat owner, 🚲 tourer. less us more them","NEOsborn","nathaniel osborn",NA,1,0,0,0,0,NA,959,1613,1860,19,"@mattcaldwell_fl @MoteMarineLab @MyFWC Not arguing. Just pointing out that the bay itself is not suffering from any such blooms. The Red Tide bloom going on now in SW #Florida started in November, well after the summer sewage dumping in Tampa Bay occurred. Suggests to me that other explanations may make more sense."
"16","Contaminated Water Alert: There was a release of sewage from an overflowing pump station to the Hillsborough River last night in the 5000 block of E. Riverhills Drive, Tampa.  Please limit contact with the River in this area for the next few days. . https   twitter com EPCHC status 1019959163533824002 photo 1","1019959163533824002","everyone",FALSE,"1019959163533824002","40763441",2018-07-19 14:56:29,"en",NA,"https://pbs.twimg.com/profile_images/876819193596973063/puB0_xBe_normal.jpg","Hillsborough County, FL","2009-05-17T23:42:42.000Z",FALSE,FALSE,"http://t.co/KFwyvcvTWU","The EPC encourages environmental stewardship in our mission to protect the natural resources and quality of life for the citizens of Hillsborough County,","EPCHC","EPC of Hillsborough",NA,3,0,0,0,0,NA,373,256,2012,5,"Contaminated Water Alert: There was a release of sewage from an overflowing pump station to the Hillsborough River last night in the 5000 block of E. Riverhills Drive, Tampa.  Please limit contact with the River in this area for the next few days. https://t.co/aafZYNPnPR"
"17","The Environmental Protection Commission of Hillsborough County has issued a Contaminated Water Alert. There was a release of sewage from an overflowing pump station to the Hillsborough River on the evening of July 18, 2018 at the 5000 block of E. Riverhills Drive, Tampa, FL.. ","1020065173233643525","everyone",FALSE,"1020065173233643525","10349062",2018-07-19 21:57:43,"en",NA,"https://pbs.twimg.com/profile_images/529461818700214273/XgAVzsC__normal.png","USA","2007-11-18T05:55:28.000Z",FALSE,FALSE,NA,"Art is in my heart and technology flows through my veins.  As an Amazon Associate (other) I earn from qualifying purchases.  Assume all links may be affiliate.","f3rdito","F3RDito","1441296324230451201",0,0,0,0,0,NA,1632,2981,16013,58,"The Environmental Protection Commission of Hillsborough County has issued a Contaminated Water Alert. There was a release of sewage from an overflowing pump station to the Hillsborough River on the evening of July 18, 2018 at the 5000 block of E. Riverhills Drive, Tampa, FL."
"18","RT @EPCHC: Contaminated Water Alert: There was a release of sewage from an overflowing pump station to the Hillsborough River last night in…","1020454301188206592","everyone",FALSE,"1020454301188206592","520230988",2018-07-20 23:43:59,"en",NA,"https://pbs.twimg.com/profile_images/1885723166/hangtenbro_normal.jpg",NA,"2012-03-10T08:56:42.000Z",FALSE,FALSE,NA,"","CG_BabaBirdy","Charissa Gionet",NA,3,0,0,0,0,NA,32,184,700,0,"Contaminated Water Alert: There was a release of sewage from an overflowing pump station to the Hillsborough River last night in the 5000 block of E. Riverhills Drive, Tampa.  Please limit contact with the River in this area for the next few days. https://t.co/aafZYNPnPR"
"19","As an avid angler I see big changes in Tampa because of runoff and dumping sewage into the bay. These are all infrastructure issues that need to be addressed and protected. Gov Rick Scott aka: skeletor don't and haven't given a $hit for years. This is not political! . https   twitter com EdKrassen status 1023192534087020545","1023264040167120901","everyone",FALSE,"1023264040167120901","733277266185224193",2018-07-28 17:48:53,"en",NA,"https://pbs.twimg.com/profile_images/1189150654796894213/Ho9FA6wT_normal.jpg","Tampa, FL","2016-05-19T12:44:58.000Z",FALSE,FALSE,NA,"Proud father and lover of life. Addicted angler and family man. Advocate for my boy that has #autism. It doesn't define him.","joelkapp","Joel Kapp",NA,0,0,3,0,0,NA,180,427,3643,1,"As an avid angler I see big changes in Tampa because of runoff and dumping sewage into the bay. These are all infrastructure issues that need to be addressed and protected. Gov Rick Scott aka: skeletor don't and haven't given a $hit for years. This is not political! https://t.co/uEpuESdDsZ"
"20","Tampa Bay's sewage mess: 29 million gallons spilled into the bay and rising 

@StPeteFL @ScottforFlorida @SiestaKey 

#REDTIDE FEEDERS AND HERES HOW ! LOOK

@MiamiHEAT @OrlandoMagic @TampaBayStorm @RaysBaseball @JSUNews @mysuncoast @bradentonherald @tbocom. https   www tampabay com news environment water tampa bays sewage mess 29 million gallons spilled into the bay and rising 2292477","1025138550570934278","everyone",FALSE,"1025138550570934278","82238235",2018-08-02 21:57:31,"en",NA,"https://pbs.twimg.com/profile_images/1050714082905661440/dF6DnFwt_normal.jpg","CLASSIFIED   #Sept11 #WTC 9/11","2009-10-14T00:55:18.000Z",FALSE,FALSE,"https://t.co/74fh08chzZ","💥💥💥💥💥💥🔫 😎👍✨ ✨XI✨ ✨","RattlesnakeX","LIBERTY OR DEATH","1026114656975376384",0,0,0,0,0,NA,812,880,21249,24,"Tampa Bay's sewage mess: 29 million gallons spilled into the bay and rising https://t.co/95e4AUGIZ5

@StPeteFL @ScottforFlorida @SiestaKey 

#REDTIDE FEEDERS AND HERES HOW ! LOOK

@MiamiHEAT @OrlandoMagic @TampaBayStorm @RaysBaseball @JSUNews @mysuncoast @bradentonherald @tbocom"
"21","GOP disgusting mess in Florida manatees rotting on the beaches, fish killing wildlife smells awful. National treasure our seas turned into a sewer. Tampa has same issues Huston too Dumping into the Gulf!! This is our only 🌎 WTF‼️‼️‼️ . https   twitter com NelsonForSenate status 1026873468942512128","1026933918430371840","everyone",FALSE,"1026933918430371840","442428404",2018-08-07 20:51:40,"en",NA,"https://pbs.twimg.com/profile_images/1418309132399095808/WFCot7EA_normal.jpg","Tarpon Springs, FL","2011-12-21T03:30:52.000Z",FALSE,FALSE,NA,"Native #RESIST #ENOUGH No-NRA. ANTI-45‼️🤬 Animal lover! too old to give a shit.. 420 #BlueWave #UniteTheUSA🌊🌊","Horan_Debbyv","Debby Horan",NA,0,0,0,0,0,NA,1460,2457,12102,0,"GOP disgusting mess in Florida manatees rotting on the beaches, fish killing wildlife smells awful. National treasure our seas turned into a sewer. Tampa has same issues Huston too Dumping into the Gulf!! This is our only 🌎 WTF‼️‼️‼️ https://t.co/EvIs0p6ewt"
"22","Can you spare a minute to help Lesley Klein? . https   www change org p mayor rick kriseman stop st pete s illegal dumping of raw and partially treated sewage into tampa bay s water fbog 1203726","1028151461279092737","everyone",FALSE,"1028151461279092737","17984734",2018-08-11 05:29:45,"en",NA,"https://pbs.twimg.com/profile_images/605887406982623232/EUu9JqZw_normal.jpg","Murphy, NC","2008-12-09T05:11:18.000Z",FALSE,FALSE,"https://t.co/H0UNFJHqL3","Co-Founder/Director of Operations: Legrity Media. Host: Good-Vibes TV airing on Legrity TV, a streaming TV digital Network that positively impacts lives.","LesleyKlein","LesleyKlein",NA,0,0,0,0,0,NA,187,339,5078,0,"Can you spare a minute to help Lesley Klein? https://t.co/U6Bhohz7nw"
"23","Share petition · Mayor Rick Kriseman: Stop St. Pete's illegal dumping of raw and partially treated sewage into Tampa Bay's water ·  . https   www change org. https   www change org p mayor rick kriseman stop st pete s illegal dumping of raw and partially treated sewage into tampa bay s water psf share","1028151548650704896","everyone",FALSE,"1028151548650704896","17984734",2018-08-11 05:30:05,"en",NA,"https://pbs.twimg.com/profile_images/605887406982623232/EUu9JqZw_normal.jpg","Murphy, NC","2008-12-09T05:11:18.000Z",FALSE,FALSE,"https://t.co/H0UNFJHqL3","Co-Founder/Director of Operations: Legrity Media. Host: Good-Vibes TV airing on Legrity TV, a streaming TV digital Network that positively impacts lives.","LesleyKlein","LesleyKlein",NA,0,0,0,0,0,NA,187,339,5078,0,"Share petition · Mayor Rick Kriseman: Stop St. Pete's illegal dumping of raw and partially treated sewage into Tampa Bay's water · https://t.co/R4Zw5JAQhE https://t.co/haKt6EDZkj"
"24","The St. Pete city council voted to settle the case against the city for dumping 200+ millions of gallons of waste in Tampa bay by donating $200,000 to the Tampa Bay Estuary Program... . https   stpetecatalyst com st pete city council approves settlement in sewage spill lawsuit","1028623714915700736","everyone",FALSE,"1028623714915700736","2717406540",2018-08-12 12:46:19,"en",NA,"https://pbs.twimg.com/profile_images/702994612403707905/g22j4-iD_normal.jpg","St Petersburg, FL","2014-08-08T16:19:24.000Z",FALSE,FALSE,"http://t.co/7gPt43QYQW","We are studying eco-villages across the country in order to create the best design for a network of replicable, therapeutic, functioning sustainable villages.","IllumiNationPrj","Illumi-NationProject",NA,0,0,0,0,0,NA,14,24,363,0,"The St. Pete city council voted to settle the case against the city for dumping 200+ millions of gallons of waste in Tampa bay by donating $200,000 to the Tampa Bay Estuary Program... https://t.co/mj7J2waaL9"
"25","Tampa News You asked: Why do we still dump sewage onto our beaches? - Miami Herald  . https   news google com home. https   twitter com Tampa_NC status 1029029093814091776 photo 1","1029029093814091776","everyone",FALSE,"1029029093814091776","213895894",2018-08-13 15:37:09,"en",NA,"https://pbs.twimg.com/profile_images/664565240718225408/R8vvlI4y_normal.jpg","Tampa, FL","2010-11-10T01:45:00.000Z",FALSE,FALSE,"http://t.co/D4cEUWUxVe","Updated Tampa news,sports,
weather,entertainment,politics
and business information.","Tampa_NC","Tampa NewsChannel",NA,0,0,1,0,0,NA,382,42,47588,17,"Tampa News You asked: Why do we still dump sewage onto our beaches? - Miami Herald https://t.co/TDR7YaOA4d https://t.co/82cMFfquiD"
"26","Microbubbles reveal efficacy of radiation against cancer, Sewage Overflow Again Fouls Tampa Bay After Storm ... - . http   medpharmnews com archives 1919","1029520322435928065","everyone",FALSE,"1029520322435928065","4855478036",2018-08-15 00:09:07,"en",NA,"https://pbs.twimg.com/profile_images/694965423213641728/SRihR1vM_normal.jpg",NA,"2016-02-03T19:24:30.000Z",FALSE,FALSE,NA,"There are 3 types of people in the world- vegetarian, non-veterinarian & Tuesday Saturday","shizuearmstron6","Shizue Armstrong",NA,0,0,0,0,0,NA,0,0,1731,0,"Microbubbles reveal efficacy of radiation against cancer, Sewage Overflow Again Fouls Tampa Bay After Storm ... - https://t.co/IvmBRwZNX9"
"27","@volleypc @RedTRaccoon Just ask the city of St. Petersburg Florida who has dumped sewage into Tampa Bay several times.....😳😳😳😳. ","1039673651354841088","everyone",FALSE,"1039662873570672642","42093105",2018-09-12 00:34:49,"en","17529457","https://pbs.twimg.com/profile_images/1590855983441526787/Z0JK7Zkq_normal.jpg","Florida, USA","2009-05-23T20:37:19.000Z",FALSE,FALSE,NA,"Proud Democrat in a growing scourge of MAGA Floridians.
Don't let YOUR freedoms get stripped from OUR country!
#SupportBlue ANYTIME you can.","VPVP1957","VLP 🖖","1565324130479751169",0,1,1,0,0,NA,735,1765,70107,14,"@volleypc @RedTRaccoon Just ask the city of St. Petersburg Florida who has dumped sewage into Tampa Bay several times.....😳😳😳😳"
"28","TAMPA WASTE MANAGEMENT workers with EnviroWaste on ground in Fayetteville, NC helping city pump out its storm water system. Cape Fear River continues to rise, expected to crest Wednesday at close to 62’. More reports today for our Carolina stations as well as @BN9 @MyNews13 . https   twitter com Jason_Lanning status 1042016825746354176 photo 1","1042016825746354176","everyone",FALSE,"1042016825746354176","443353683",2018-09-18 11:45:45,"en",NA,"https://pbs.twimg.com/profile_images/1707209585/jason_lanning_normal.jpg","Tampa, FL","2011-12-22T03:06:59.000Z",FALSE,FALSE,"https://t.co/WR0tlyqfaF","Award-winning Spectrum Bay News 9 Reporter on TV in Tampa, FL - Husband, Dad and neighborhood eye-candy behind the scenes.","Jason_Lanning","Jason Lanning",NA,7,1,16,1,0,NA,681,168,697,45,"TAMPA WASTE MANAGEMENT workers with EnviroWaste on ground in Fayetteville, NC helping city pump out its storm water system. Cape Fear River continues to rise, expected to crest Wednesday at close to 62’. More reports today for our Carolina stations as well as @BN9 @MyNews13 https://t.co/Vs5tK33AyI"
